Ligne précédente,Date,Heure
“الأحرار” يترأس غرفة الصناعة التقليدية بسوس,23 غشت 2021,15:55
تحذير حكومي من استغلال المساجد تزامنا مع الانتخابات,23 غشت 2021,15:49
سفيرة المغرب بإسبانيا تستعد للعودة إلى مدريد قريبا,23 غشت 2021,14:51
بوتين وأردوغان يناقشان هاتفيا الوضع في أفغانستان,21 غشت 2021,22:05
حزب البيجيدي يهدد “منشقين عنه” بالقضاء,20 غشت 2021,16:41
المغرب يفضح اختلال البرلمان الإفريقي,20 غشت 2021,15:35
انتخاب التجمعي”صبري”رئيسا لغرفة الصيد البحري,18 غشت 2021,14:54
انعقاد مجلس الحكومة يوم الإثنين المقبل,18 غشت 2021,14:21
نبيلة منيب تطالب بتعميم المنحة الجامعية,17 غشت 2021,16:58
انتخاب الليموري رئيسا لغرفة الصناعة بجهة الشمال,16 غشت 2021,17:13
إنتخاب الجرودي رئيسا لغرفة التجارة بجهة الشرق,16 غشت 2021,16:18
فتح باب إيداع الترشيحات للانتخابات البرلمانية والجماعية,13 غشت 2021,15:52
قيادات داخل البيجيدي ترفض خوض غمار الانتخابات,13 غشت 2021,15:26
مناورات عسكرية تجمع البحرية الملكية والباكستانية,13 غشت 2021,14:09
الولايات المتحدة تلتزم بالعمل مع المغرب وإسرائيل,12 غشت 2021,16:44
إسرائيل تفتتح مكتب الاتصال بالرباط,12 غشت 2021,14:21
المغرب وإسرائيل يوقعان 3 اتفاقيات جديدة,11 غشت 2021,18:12
وزير خارجية إسرائيل يصل المغرب في أول زيارة رسمية,11 غشت 2021,14:38
حزب الاستقلال يحسم في لائحة مرشحيه بجهة الشرق,11 غشت 2021,00:32
ضحايا “تجميد الترقيات” يصعدون في وجه وزارة “أمزازي,10 غشت 2021,18:20
مسؤولة إسبانية:“العلاقات مع المغرب أصبحت جيدة جدا”,9 غشت 2021,15:54
“الأحرار” يتصدر النتائج المؤقتة لانتخابات الغرف المهنية,9 غشت 2021,15:11
“بيغاسوس” إجراءات قانونية أمام المحاكم الإسبانية,7 غشت 2021,17:21
نسخة جديدة للموقع الخاص بالأمانة العامة للحكومة,6 غشت 2021,16:33
المغرب: توقيع مذكرة تفاهم في مجال التشغيل,6 غشت 2021,11:44
انطلاق عملية التصويت لانتخاب أعضاء الغرف المهنية,6 غشت 2021,11:19
سفراء معتمدين بالمغرب يزورون مقر ال BCIJ,6 غشت 2021,09:41
12 ألف مرشحا يدخلون غمار انتخابات الغرف المهنية,5 غشت 2021,17:26
فرنسا:المغرب دبر بفعالية حملة التلقيح تحت قيادة الملك,5 غشت 2021,12:52
فيدرالية اليسار تكشف عن مرشحيها بالقنيطرة,5 غشت 2021,12:07
بايدن يحدف “تغريدة” تضم خريطة المغرب مبتورة,4 غشت 2021,17:49
قانون جديد يجبر الأطباء على تحسين خطهم في المغرب,4 غشت 2021,15:38
قضية بيغاسوس : المغرب يقاضي صحيفة المانية,4 غشت 2021,11:38
منظمة تنادي بتعزيز العلاقات المغربية الجزائرية,3 غشت 2021,19:14
البيجيدي يرشح العثماني بدائرة الرباط المحيط بالعاصمة,3 غشت 2021,19:08
قراءة لابرز مضامين الخطاب الملكي لعيد العرش,2 غشت 2021,15:47
الحكومة تصادق على قانون جديد حول الإرهاب,29 يوليوز 2021,15:32
الملك محمد السادس يهنئ الحاكمة الجديدة لكندا‎‎,29 يوليوز 2021,14:25
مستجدات انتخابات أعضاء الغرف المهنية,28 يوليوز 2021,19:12
الرئيس التونسي يستقبل وزير الخارجية المغربي,28 يوليوز 2021,14:51
ملاوي:افتتاح قنصلية جديدة بمدينة العيون,27 يوليوز 2021,18:50
المغرب: مشاركة عدة دول في المنتدى الدولي الافتراضي,23 يوليوز 2021,20:58
انتخابات أعضاء الغرف المهنية,23 يوليوز 2021,19:20
تعيين مسؤولين قضائيين بعدد من محاكم المملكة,23 يوليوز 2021,18:30
الملك يهنئ ماكرون بمناسبة العيد الوطني لفرنسا,14 يوليوز 2021,17:20
أمكراز يحيل ملف اختلالات التعاضدية العامة على القضاء,14 يوليوز 2021,15:01
الرباط :ندوة حول موضوع “المرأة و الطريق نحو المساواة”,13 يوليوز 2021,14:42
مقترح قانون جديد لتعديل المادة 21 من قانون الصحافة,12 يوليوز 2021,16:58
تعزيز التعاون الثنائي بين المغرب وهولندا,9 يوليوز 2021,14:26
وزارة الخارجية المغربية تخرج 22 دولة من الائحة ب,6 يوليوز 2021,19:38
المغرب يقرر تصنيع 5 ملايين جرعة من لقاح كورونا شهريا,6 يوليوز 2021,18:04
إسرائيل والمغرب معا في تدريبات عسكرية دولية,5 يوليوز 2021,17:58
الملك محمد السادس يهنئ شعب الجزائر,5 يوليوز 2021,16:31
تنصيب القنصل الجديد للمغرب بمدينة آلبورغ الدنماركية,5 يوليوز 2021,14:48
الملك يبعث برقية تهنئة للحاكم العام بالنيابة لكندا,1 يوليوز 2021,15:08
فرض كتابة الأسماء بالأمازيغية في الحالة المدنية,30 يونيو 2021,19:21
منع محام بلجيكي من دخول المغرب,29 يونيو 2021,18:25
الملك يترأس مجلسا وزاريا بفاس,28 يونيو 2021,19:22
دعم اتحاد المحامين العرب للوحدة الترابية المغربية,28 يونيو 2021,15:36
المغرب: المشاركة في اجتماع دولي لمكافحة “داعش”,28 يونيو 2021,14:40
بوريطة يستقبل عقيلة صالح,25 يونيو 2021,00:10
المانيا تدعو المغرب الى الحوار لفك الازمة الديبلوماسية,24 يونيو 2021,16:15
إنعقاد مجلس حكومي يوم الخميس وهذه مضامينه!,21 يونيو 2021,16:43
إسبانيا: نتفهم مدى أهمية ملف الصحراء بالنسبة للمغرب,21 يونيو 2021,15:05
العثماني يشيد بتلقيح الملك,1 فبراير 2021,17:37
أسباب التأخر الفرنسي في الاعتراف بمغربية الصحراء,1 فبراير 2021,12:56
العثماني: دلالات إعطاء الملك انطلاق الحملة الوطنية,29 يناير 2021,13:07
انتصار المغرب في ملف ليبيا وقضية الصحراء,29 يناير 2021,13:00
حزب الاتحاد الاشتراكي يثمن المجهودات الملكية,29 يناير 2021,12:56
