Ligne précédente,Date,Heure
صفرو: اطلاق لقاءات الويكاند المواطن الحوارية والتكوينية,30 أكتوبر 2021,13:28
نزار بركة يؤكد ضرورة استراتيجية ملائمة لتدبير الحركة الطرقية في,29 أكتوبر 2021,17:54
مجلس الأمن يمدد ولاية بعثة المينورسو لمدة عام بالصحراء المغربية,29 أكتوبر 2021,16:45
المحكمة الدستورية تلقت 62 عريضة طعن بشأن المنازعات المتعلقة بانتخاب,29 أكتوبر 2021,14:41
كولومبيا-المغرب.. الدعوة إلى استمثار فرص التعاون الاقتصادي والفلاحي,29 أكتوبر 2021,11:27
السيد أخنوش ونائبة الرئيس الكولومبي يشيدان بالمستوى المتميز لعلاقات الصداقة,28 أكتوبر 2021,21:17
كيغالي.. افتتاح الاجتماع الوزاري التحضيري الثاني للقمة المقبلة للاتحاد الافريقي-الاتحاد,26 أكتوبر 2021,16:17
انتخاب الحسين عليوى رئيسا لجامعة الغرف المغربية للتجارة والصناعة والخدمات,25 أكتوبر 2021,19:34
منع نبيلة منيب من دخول مجلس النواب بسبب جواز التلقيح,25 أكتوبر 2021,17:44
اهتمامات الصحف المغربية لنهاية الأسبوع,23 أكتوبر 2021,18:35
قضاة ينتخبون ممثليهم في المجلس الأعلى للسلطة القضائية,23 أكتوبر 2021,15:59
الدورة السادسة للجمعية العامة للمجلس الوطني لحقوق الإنسان .. المصادقة,23 أكتوبر 2021,15:55
الصحراء المغربية.. الأردن تجدد دعمها لمبادرة الحكم الذاتي في إطار,23 أكتوبر 2021,10:00
إلزامية جواز التلقيح لدخول مجلس النواب الذي يعقد الاثنين المقبل,22 أكتوبر 2021,11:32
وفد مغربي رفيع المستوى يحل بالعاصمة الليبية طرابلس,21 أكتوبر 2021,15:23
الصحراء المغربية: مجموعة دول أمريكا اللاتينية والكاريبي تجدد دعمها “الثابت”,21 أكتوبر 2021,14:55
ميزانية الدولة: رصيد يفوق 102 مليار درهم برسم سنة 2022,19 أكتوبر 2021,16:40
الدبلوماسي المخضرم يوسف العمراني سفيرا للمغرب لدى الاتحاد الأوربي,19 أكتوبر 2021,06:28
رسميا : المصادقة على مشروع قانون المالية برسم سنة 2022,18 أكتوبر 2021,19:11
مجلس الحكومة يتدارس مشروع قانون المالية لسنة 2022,18 أكتوبر 2021,17:25
اليوم المغربي: خبراء أفارقة يدعون من تنزانيا لطرد البوليساريو من,18 أكتوبر 2021,13:35
بلاغ : جلالة الملك يترأس مجلسا وزاريا,17 أكتوبر 2021,18:59
انعقاد مجلس الحكومة برئاسة السيد عزيز أخنوش,16 أكتوبر 2021,14:57
الذكرى 46 للإعلان عن تنظيم المسيرة الخضراء.. محطة مشرقة لاستكمال,15 أكتوبر 2021,19:34
انعقاد مجلس الحكومة غدا السبت,15 أكتوبر 2021,17:54
الصحراء المغربية : تفاؤل عام بمجلس الأمن إزاء استئناف المسلسل,15 أكتوبر 2021,17:45
المجلس التنفيذي للاتحاد الإفريقي يفتتح أشغال دورته العادية الـ39 بمشاركة,15 أكتوبر 2021,16:33
العيون – الساقية الحمراء: تنصيب الكاتب العام المكلف بالشؤون الجهوية,15 أكتوبر 2021,05:20
مجلس جماعة الرباط ينتخب هياكله ترأستها عمدة الرباط أسماء غلالو,14 أكتوبر 2021,21:16
الرئيس الجزائري ينهي مهام سفيره بالرباط,14 أكتوبر 2021,18:11
بلاغ للديوان الملكي : تعيين خالد أيت الطالب وزيرا للصحة,14 أكتوبر 2021,16:33
المغرب يتفاوض مع تركيا من أجل صفقة جديدة لشراء طائرات,14 أكتوبر 2021,13:12
مجلس الأمن يعقد مشاورات مغلقة حول قضية الصحراء المغربية,14 أكتوبر 2021,12:54
عاجل : مجلس النواب يصادق بالأغلبية على البرنامج الحكومي,13 أكتوبر 2021,19:47
عدد من السفراء الجدد يقدمون اعتماداتهم للسيد بوريطة,13 أكتوبر 2021,19:24
مجلس جهة كلميم – واد نون ينتخب رؤساء ونواب لجانه,13 أكتوبر 2021,18:37
البرنامج الحكومي حمل أجوبة واضحة وشفافة للعديد من الانتظارات السياسية,13 أكتوبر 2021,14:01
جلستان عموميتان بمجلس النواب لمناقشة والتصويت على البرنامج الحكومي,13 أكتوبر 2021,13:03
مجلس النواب يعقد جلستين عموميتين غدا الأربعاء للمناقشة والتصويت على,12 أكتوبر 2021,12:04
معهد السياسات يتوج أبحاثا حول قضايا المغرب,12 أكتوبر 2021,11:15
السيد أخنوش : الالتزام بإنجاز الأوراش الاستراتيجية الكبرى و النموذج,11 أكتوبر 2021,21:00
مجلس المستشارين يعقد جلسة عمومية يوم الأربعاء لمناقشة البرنامج الحكومي,11 أكتوبر 2021,20:30
جلالة الملك يهنئ السيد النعم ميارة بمناسبة انتخابه رئيسا لمجلس,11 أكتوبر 2021,19:26
مجلس النواب.. انتخاب أعضاء المكتب ورؤساء اللجان الدائمة,11 أكتوبر 2021,17:06
السيد أخنوش يؤكد عزم الحكومة على أن تكون في مستوى,11 أكتوبر 2021,14:57
محلل رواندي : الخطاب الملكي رؤية تطلعية لمغرب الغد,11 أكتوبر 2021,11:10
الأمين العام للأمم المتحدة يبرز التعاون التام للمغرب مع بعثة,10 أكتوبر 2021,23:21
مجلس المستشارين.. انتخاب أعضاء المكتب ورؤساء اللجان الدائمة,10 أكتوبر 2021,22:09
جلسة عمومية مشتركة غدا الاثنين لمجلسي البرلمان لتقديم رئيس الحكومة,10 أكتوبر 2021,18:25
الولاية التشريعية الـ11 تدشن لمرحلة جديدة من البناء الديمقراطي وترسيخ,9 أكتوبر 2021,19:55
انطلاق أشغال الجلسة المخصصة لانتخاب رئيس مجلس النواب,9 أكتوبر 2021,16:00
الخطاب الملكي حمل رسائل جوهرية حول تدبير الشأن العام الوطني,9 أكتوبر 2021,15:28
الخطاب الملكي يشكل خريطة ذهنية محكمة توضح للمغاربة كل ما,9 أكتوبر 2021,14:23
الخطاب الملكي يعطي دفعة قوية لتنزيل النموذج التنموي الجديد,9 أكتوبر 2021,12:00
انعقاد جلسة عمومية غدا السبت لانتخاب رئيس مجلس المستشارين,8 أكتوبر 2021,18:58
الجديد في فريق الحكومة المغربية,8 أكتوبر 2021,18:32
خالد آيت طالب وزير الصحة المنتهية ولايته يسلم منصبه لنبيلة,8 أكتوبر 2021,17:40
وزارة السياحة: تسليم السلط بين السيدتين فاطمة الزهراء عمور ونادية,8 أكتوبر 2021,15:41
التكوين المهني.. تسليم السلط بين السيدين أمزازي والسكوري,8 أكتوبر 2021,15:20
فيديو : في مشهد مؤثر…الدموع تغالب وزير التجارة والصناعة السابق,8 أكتوبر 2021,15:07
إسبانيا ترغب في العمل مع الحكومة المغربية الجديدة في أسرع,8 أكتوبر 2021,14:08
تسليم السلط بين السيد سعد الدين العثماني ورئيس الحكومة الجديد,8 أكتوبر 2021,13:29
بروفايلات الحكومة الجديدة: الجدارة في التدبير والانفتاح على الكفاءات الشابة,8 أكتوبر 2021,05:19
فيديو : تصريح عزيز أخنوش بعد تعيين أعضاء الحكومة المغربية,7 أكتوبر 2021,21:35
فيديو : الملك محمد السادس يترأس مراسم تعيين أعضاء الحكومة,7 أكتوبر 2021,19:49
عاجل : جلالة الملك يترأس مراسم تعيين أعضاء الحكومة الجديدة,7 أكتوبر 2021,18:00
مختصرات من جهة طنجة-تطوان-الحسيمة,7 أكتوبر 2021,15:07
انعقاد جلسة عمومية بعد غد السبت لانتخاب رئيس مجلس النواب,7 أكتوبر 2021,14:46
حضور على عدد محدود من البرلمانيين عن الأحزاب السياسية والمنظمات,7 أكتوبر 2021,13:58
حزب العدالة و التنمية يشكك في نتائج انتخابات المستشارين و,7 أكتوبر 2021,13:32
جلالة الملك محمد السادس يفتتح البرلمان عن بعد,7 أكتوبر 2021,12:44
سانتياغو: الاحتفاء بالذكرى ال 60 للعلاقات الدبلوماسية بين المغرب والشيلي,7 أكتوبر 2021,10:50
باحث: توفر مكونات الحكومة على أغلبية بالغرفة الثانية سيسهل عليها,7 أكتوبر 2021,10:32
انتخابات مجلس المستشارين: المغرب نجح في استكمال المسار الاستحقاقي الانتخابي,6 أكتوبر 2021,23:30
وارسو.. تسليم الحمالة الكبرى للوسام العلوي لسفيرة بنغلاديش السابقة في,6 أكتوبر 2021,19:33
سويسرا.. وزيرة العدل تجدد تأكيد موقف بلادها بخصوص قضية الصحراء,6 أكتوبر 2021,17:19
المحكمة الدستورية ستشرع في تلقي الطعون الانتخابية طيلة ال30 يوما,6 أكتوبر 2021,14:06
وزير الفلاحة والصيد البحري الإسباني: الدفاع عن اتفاقية الصيد البحري,6 أكتوبر 2021,13:34
دبلوماسي مغربي على رأس بعثة جامعة الدول العربية ببرلين,6 أكتوبر 2021,12:16
الأمين العام للأمم المتحدة يدعو إلى تحسين العلاقات بين المغرب,6 أكتوبر 2021,10:57
بتصدرها لانتخابات مجلس المستشارين، أحزاب الأغلبية الحكومية تكرس سيطرتها على,6 أكتوبر 2021,10:34
عملية التصويت لانتخاب أعضاء مجلس المستشارين جرت في ظروف عادية,5 أكتوبر 2021,23:55
حزب التجمع الوطني للأحرار يتصدر نتائج الاقتراع الخاص بانتخاب أعضاء,5 أكتوبر 2021,23:03
إكسبو دبي 2020 .. افتتاح فعاليات “أسبوع بيت مال القدس,5 أكتوبر 2021,22:25
الهيئة الناخبة بجهة الدار البيضاء سطات تصوت على ممثليها بمجلس,5 أكتوبر 2021,18:52
تعليق الرحلات الجوية بين المغرب وروسيا,5 أكتوبر 2021,14:18
بعد تعرض “فيسبوك” لأعطاب… مارك زوكربيرغ تخسر 7 ملايير دولار,4 أكتوبر 2021,23:36
مؤرخ اسباني : الجزائر “ملاذ” إرهابيي “البوليساريو” و”إيتا”,4 أكتوبر 2021,16:47
الخارجية الإيرانية: محادثاتنا مع السعودية في أفضل حالاتها,4 أكتوبر 2021,16:15
اهتمامات الصحف الإفريقية…,4 أكتوبر 2021,14:45
الأمين العام للأمم المتحدة يؤكد وجود عناصر مسلحة من “البوليساريو”,4 أكتوبر 2021,14:18
السفير الإسباني الأسبق .. إسبانيا مدعوة لدعم الحكم الذاتي تحت,3 أكتوبر 2021,20:41
انتخاب أعضاء مجلس المستشارين: الائتلاف الحكومي في مسعى لتشكيل أغلبية,2 أكتوبر 2021,17:15
انتخاب أعضاء الاتحاد العام لمقاولات المغرب لمجلس المستشارين,2 أكتوبر 2021,13:07
القطريون ينتخبون أول مجلس تشريعي يوم غد,1 أكتوبر 2021,23:23
اهتمامات الصحف المغربية,1 أكتوبر 2021,13:35
انتخابات أعضاء مجلس المستشارين .. الناخبون الكبار يختارون ممثليهم,1 أكتوبر 2021,13:35
منظمة العفو الدولية تدعو الجزائر الى وضع حد لمقاضاة النشطاء,1 أكتوبر 2021,12:51
إقليم اشتوكة أيت باها.. جهود متواصلة للسيطرة على حريق اندلع,30 شتنبر 2021,22:54
نائب عمدة الدار البيضاء يستقيل من منصبه,30 شتنبر 2021,13:27
المغرب يدعو إلى الدخول حيز التنفيذ بشكل فوري لمعاهدة الحظر,30 شتنبر 2021,10:55
تقليص عدد التأشيرات الفرنسية .. فرنسيون من أصل مغربي يستنكرون,29 شتنبر 2021,19:08
محكمة العدل الأوروبية تقرر إلغاء اتفاق الزراعة والصيد مع المغرب,29 شتنبر 2021,16:08
وزير خارجية إسبانيا يزور الجزائر للحفاظ على تصدير الغاز الى,29 شتنبر 2021,15:54
انتخاب عبد الإله بعزيز رئيسا للمجلس الإقليمي لعمالة تازة,29 شتنبر 2021,14:41
انتخاب إسماعيل الرايس، عن حزب التجمع الوطني للأحرار، رئيسا للمجلس,29 شتنبر 2021,12:16
السيد بوريطة :قرار فرنسا تشديد شروط منح التأشيرات لا يعكس,28 شتنبر 2021,20:06
انتخاب السعيد أفروخ، عن الحركة الشعبية، رئيسا للمجلس الإقليمي لورزازات,28 شتنبر 2021,20:01
انتخاب حميد البابور عن التجمع الوطني للأحرار رئيسا للمجلس الإقليمي,28 شتنبر 2021,19:41
ناصر بوريطة : علاقات وطيدة تجمع المغرب بموريتانيا,28 شتنبر 2021,19:09
التجمع الوطني للأحرار يعقد لقاءا مع “مغاربة كندا”,28 شتنبر 2021,17:15
انتخاب ابراهيم بنصبيح عن الأصالة والمعاصرة ، رئيسا جديدا للمجلس,28 شتنبر 2021,16:51
بوريطة : المغرب يعتبر القرار الفرنسي تشديد شروط منح التأشيرات,28 شتنبر 2021,15:41
وزارة الدولة المكلفة بحقوق الانسان والعلاقات مع البرلمان تصدر الدليل,28 شتنبر 2021,15:15
انتخاب الطالبي العلمي رئيسا للفريق النيابي للأحرار بمجلس النواب,28 شتنبر 2021,14:59
المغرب : رهان التلقيح فرصة لإعطاء زخم جديد للعمل متعدد,28 شتنبر 2021,14:55
القوات المسلحة الملكية رائد إقليمي (دبلوماسيون أمريكيون),28 شتنبر 2021,14:46
بوريطة : المغرب سيواصل جهوده لصالح حل سلمي في ليبيا,28 شتنبر 2021,13:08
إعادة انتخاب الشيخ بنان، عن حزب الاستقلال، رئيسا للمجلس الإقليمي,28 شتنبر 2021,12:57
انتخاب عبد الرحمن الكوشي، عن حزب الأصالة والمعاصرة، رئيسا لمجلس,28 شتنبر 2021,11:34
الاستحقاقات الانتخابية كرست مسلسل التناوب الديموقراطي بالمغرب (جامعي),27 شتنبر 2021,22:01
الداخلية : ربع المقاعد للنساء و 18 %من البرلمانيين فقط,27 شتنبر 2021,17:07
حزب الاتحاد الاشتراكي يفوز بـ 8 جماعات من أصل 25,26 شتنبر 2021,17:18
إغلاق مطار جزيرة “لابالما” في الكناري بسبب سحب الرماد البركاني,25 شتنبر 2021,19:11
الموساوي العجلاوي :الحكومة المقبلة ستكون مطالبة ببرنامج واقعي يستجيب لانتظارات,25 شتنبر 2021,16:21
نبذة عن سيدي حمدي ولد الرشيد رئيس مجلس جهة العيون,25 شتنبر 2021,16:08
مراكش..انتخاب محمد نكيل عن حزب الأصالة والمعاصرة رئيسا لمجلس مقاطعة,25 شتنبر 2021,13:48
انتخاب محمد بلعروسي عن حزب الأصالة والمعاصرة، رئيسا جديدا لمجلس,25 شتنبر 2021,12:35
توافق بين ماكرون وميقاتي حول الإصلاحات “العاجلة” في لبنان,24 شتنبر 2021,21:00
عاجل: بوتشيمون خرج من السجن وسُمح له بمغادرة إيطاليا,24 شتنبر 2021,19:12
إلغاء انتخاب رئيس جماعة الناظور وسبعة مستشارين آخرين,24 شتنبر 2021,18:34
الأمم المتحدة تدعو لحوار بناء و تجنب التصعيد بين المغرب,24 شتنبر 2021,16:43
انتخاب السيدة أسماء غلالو عن التجمع الوطني للأحرار رئيسة لمجلس,24 شتنبر 2021,14:11
انتخاب عزيز أخنوش عن حزب التجمع الوطني للأحرار رئيسا للمجلس,24 شتنبر 2021,13:49
مراسلة لوزير الداخلية للولاة و العمال بشأن تسليم السلط,24 شتنبر 2021,13:38
عاجل -السيد بوريطة: بالنسبة للمغرب، التعددية التضامنية تعد عقيدة نابعة,23 شتنبر 2021,23:01
انتخاب السيد محمد سعيد الزلال رئيسا لجماعة دار الشاوي لولاية,23 شتنبر 2021,22:52
رئيس وزراء إسبانيا يدافع عن استقبال “بن بطوش” من منبر,23 شتنبر 2021,22:46
رويترز : تعليق الخطوط الملكية المغربية على القرار الجزائري بإغلاق,23 شتنبر 2021,15:01
انتخاب المصطفى الثانوي عن حزب الاستقلال رئيسا للمجلس الجماعي لسطات,23 شتنبر 2021,14:55
جنيف.. منظمة غير حكومية تحذر من تجنيد عناصر “البوليساريو” كمرتزقة,23 شتنبر 2021,13:48
حزب الاستقلال يتصدر انتخابات المجلس الإقليمي لبنسليمان,23 شتنبر 2021,13:27
المساء : إيداع الترشيحات لانتخاب أعضاء مجلس المستشارين ستبتدئ غدا,23 شتنبر 2021,12:47
الأمين العام للجامعة العربية يبحث مع وفد من المعارضة السورية,23 شتنبر 2021,11:40
الصحراء المغربية.. إصدار دليل عملي حول الآليات الاستشارية الموازية لترافع,23 شتنبر 2021,11:33
التجمع الوطني للأحرار يتصدر نتائج انتخابات المجلس الإقليمي للقنيطرة,23 شتنبر 2021,00:12
لائحة الرؤساء الجدد لمجالس الجهات ال12 بالمملكة,22 شتنبر 2021,18:06
السعودية تعرض وساطتها لحل الأزمة بين باكستان والهند,22 شتنبر 2021,17:59
انتخاب محمد السيمو، عن حزب التجمع الوطني الأحرار، رئيسا لجماعة,22 شتنبر 2021,16:58
حزب الاستقلال يتصدر نتائج انتخابات المجلس الإقليمي للسمارة,22 شتنبر 2021,16:43
تمرين مشترك في الإغاثة والإنقاذ بين القوات المسلحة الملكية والحرس,22 شتنبر 2021,16:37
انتخاب عبد المومن الصبيحي، عن حزب الاصالة والمعاصرة، رئيسا لمجلس,22 شتنبر 2021,16:35
العراق يعلن عن تحرك لرفع شكوى دولية ضد إيران بشأن,22 شتنبر 2021,16:31
انتخاب محمد الهلاوي، عن التجمع الوطني للأحرار، رئيسا لمجلس جماعة,22 شتنبر 2021,16:13
السيد لشكر .. معارضة الاتحاد الاشتراكي للقوات الشعبية ستكون سياسية,22 شتنبر 2021,16:07
حزب التجمع الوطني للأحرار يتصدر نتائج انتخاب أعضاء مجالس العمالات,22 شتنبر 2021,15:09
مطعم بنيويورك يرفض استقبال رئيس البرازيل,22 شتنبر 2021,14:59
عبد الواحد الأنصاري رئيسا لجهة فاس مكناس,22 شتنبر 2021,14:21
التجمع الوطني للأحرار يتصدر نتائج انتخاب أعضاء المجلس الإقليمي لتنغير,22 شتنبر 2021,14:18
حزب التجمع الوطني للأحرار يتصدر نتائج انتخابات المجلس الإقليمي لطاطا,22 شتنبر 2021,14:08
أخنوش يعلن تشكيل التحالف الحكومي من ثلاثة أحزاب,22 شتنبر 2021,13:30
حزب الاستقلال يتصدر نتائج انتخابات المجلس الإقليمي للعيون,22 شتنبر 2021,13:20
تطوان :توقيف أربعة أشخاص للاشتباه في تورطهم في قضية تتعلق,22 شتنبر 2021,11:54
مجلس عمالة الدار البيضاء ..الأصالة والمعاصرة يظفر ب14 مقعدا من,22 شتنبر 2021,00:07
أحزاب الأحرار والاستقلال والتقدم والاشتراكية تظفر بغالبية مقاعد المجلس الإقليمي,21 شتنبر 2021,23:58
أبرز ما جاء في كلمة الأمين العام للأمم المتحدة في,21 شتنبر 2021,19:24
أبرز ما جاء في كلمة الرئيس الأمريكي في افتتاح الجمعية,21 شتنبر 2021,18:38
سيرة ذاتية عن الرئيس الجديد لجهة طنجة تطوان الحسيمة,21 شتنبر 2021,18:37
انتخاب أعضاء مجلس المستشارين .. فترة إيداع الترشيحات مابين 24,21 شتنبر 2021,17:32
سفير كوريا الجنوبية بالمغرب يشيد بتطور العلاقات مع الرباط,21 شتنبر 2021,17:27
مع “ناصر بوريطة”.. أول تعليق لرئيس مجلس الأعلى الليبي حول,21 شتنبر 2021,17:10
اجتماع مرتقب يوم غد بين “بوريطة” ووزير خارجية إسبانيا,21 شتنبر 2021,17:06
انطلاق أشغال الدورة السادسة والسبعين للجمعية العامة للأمم المتحدة في,21 شتنبر 2021,17:02
القضاء الإسباني.. استدعاء وزيرة الخارجية الإسبانية السابقة بخصوص إخفاء هوية,21 شتنبر 2021,16:46
انتخابات كندا : فوز الليبراليين بزعامة ترودو لكن بدون تحقيق,21 شتنبر 2021,16:45
الغارديان البريطانية: لا مصلحة بين لندن و بكين في اندلاع,21 شتنبر 2021,16:21
أزمة جديدة تلوح في الأفق .. البرلمان الليبي يسحب الثقة,21 شتنبر 2021,15:08
وفاة عبد الوهاب بلفقيه المرشح السابق متأثرا بطلق ناري بكلميم,21 شتنبر 2021,14:19
اهتمامات أبرز الصحف الأمريكية ..,21 شتنبر 2021,14:06
إعادة انتخاب امباركة بوعيدة رئيسة لمجلس جهة كلميم – وادنون,21 شتنبر 2021,12:33
قيس سعيد يعلن عن قرب تعيين رئيس حكومة جديد مع,21 شتنبر 2021,10:06
انتخاب فتيحة لحمامي عن حزب الوحدة والديمقراطية رئيسة لمجلس جماعة,20 شتنبر 2021,22:27
انتخابات ثامن شتنبر.. جمهورية كوريا تشيد بإنجاز تحقق بالمغرب وبالمنطقة,20 شتنبر 2021,22:20
انتخاب هشام قيسوني عن حزب التجمع الوطني للأحرار رئيسا للمجلس,20 شتنبر 2021,19:43
انتخاب رشيد البطاح عن حزب الأصالة والمعاصرة رئيسا لمجلس جماعة,20 شتنبر 2021,19:33
ترشيح المغرب لرئاسة الدورة السادسة لجمعية الأمم المتحدة للبيئة,20 شتنبر 2021,18:34
الولاية المتحدة الامريكية:الأجانب الملقحون ضد كوفيد-19 بإمكانهم دخول التراب الأمريكي,20 شتنبر 2021,18:04
الاتحاد الأوربي ينتقد تعامل أستراليا مع فرنسا في صفقة الغواصات,20 شتنبر 2021,17:19
بلاغ لوزارة الطاقة والمعادن والبيئة:المغرب سيترشح لتمثيل إفريقيا ورئاسة الدورة,20 شتنبر 2021,17:13
أكاديمي:المغرب منفتح على جيل جديد من الأوراش التنموية يكرس موقعه,20 شتنبر 2021,17:11
الغابون تحتفي بعيد استقلالها الـ 61 من العيون,20 شتنبر 2021,15:02
