Ligne précédente,Date,Heure
نائب رئيس مجموعة حزب الشعب الأوروبي:المغرب شريك “بالغ الأهمية” للاتحاد,20 شتنبر 2021,14:54
ترحيب سوداني لوساطة تركيا في نزاعها مع اثيوبيا,20 شتنبر 2021,14:15
عاجل: انتخاب نبيلة الرميلي عمدة للدار البيضاء,20 شتنبر 2021,14:12
انتخاب زكريا سملالي عن حزب الاتحاد الاشتراكي رئيسا للمجلس الجماعي,20 شتنبر 2021,12:56
كما كان متوقعا : مورو يتولى رئاسة جهة طنجة تطوان,20 شتنبر 2021,12:37
السيد بوريطة يجري اتصالا هاتفيا مع نظيره الموريتاني,19 شتنبر 2021,21:04
انتخاب طارق قديري عن حزب الاستقلال رئيسا للمجلس الجماعي لبرشيد,19 شتنبر 2021,19:43
إعادة انتخاب امبارك عفيري عن حزب الاستقلال رئيسا لجماعة المنصورية,19 شتنبر 2021,16:43
انعقاد المؤتمر الوطني الاستثنائي لحزب العدالة والتنمية نهاية أكتوبر,19 شتنبر 2021,14:58
لخصم رئيسا لجماعة إيموزار كندر,19 شتنبر 2021,14:43
انتخاب المصطفى مهدي، عن الاتحاد الاشتراكي للقوات الشعبية، رئيسا لجماعة,19 شتنبر 2021,14:32
المجلس الوطني لحزب الاستقلال يوافق ويدعم مشاركة الحزب في الحكومة,18 شتنبر 2021,19:23
هشام آيت مانة عن التجمع الوطني للأحرار رئيسا لمجلس جماعة,18 شتنبر 2021,19:16
انتخاب عبد اللطيف وهبي عن حزب الأصالة والمعاصرة رئيسا للمجلس,18 شتنبر 2021,17:28
انتخاب حنان مبروك عن حزب الأصالة والمعاصرة رئيسة للمجلس الجماعي,18 شتنبر 2021,16:25
إعادة انتخاب السيد محمد كريمين عن حزب الاستقلال رئيسا للمجلس,18 شتنبر 2021,14:53
انتخاب رشيد العبدي عن حزب الأصالة والمعاصرة رئيسا لمجلس جهة,18 شتنبر 2021,14:35
انتخابات 8 شتنبر..رياح التغيير تهب على جهة الرباط -سلا -القنيطرة,18 شتنبر 2021,14:13
إعادة انتخاب عبد النبي بعوي عن حزب الأصالة والمعاصرة رئيسا,18 شتنبر 2021,13:24
المنظمة الدولية للهجرة تعلن عن تنظيم الدورة الأولى لجائزة الصحافة,18 شتنبر 2021,13:20
المحكمة الدستورية في جنوب إفريقيا تؤيد إدانة زوما بازدراء القضاء,18 شتنبر 2021,13:16
الجزائر..حزب “التجمع من أجل الثقافة والديمقراطية” يقاطع الانتخابات المحلية المقررة,18 شتنبر 2021,11:13
دعوة توحيد إجراءات تسجيل واعتماد اللقاحات واستخدامها بين الدول العربية,17 شتنبر 2021,22:43
المجلس الوطني للأصالة والمعاصرة يوافق على مشاركة الحزب في الحكومة,17 شتنبر 2021,22:12
انتخاب امحمد الزكراني عن حزب الاستقلال رئيسا للمجلس الجماعي لخريبكة,17 شتنبر 2021,22:09
انتخاب رشيد عدنان عن حزب الاستقلال رئيسا لمجلس جماعة ميدلت,17 شتنبر 2021,19:20
انتخاب عبد الله حينتي عن التجمع الوطني للأحرار رئيسا للمجلس,17 شتنبر 2021,16:50
إعادة انتخاب عبد الحي حرطون عن التجمع الوطني للأحرار رئيسا,17 شتنبر 2021,16:32
بغداد وواشنطن تتفقان على تقليص القوات العسكرية الأمريكية من قواعد,17 شتنبر 2021,16:03
تعزيز التعاون العلمي بين المغرب وهنغاريا في المجال الطبي,17 شتنبر 2021,15:47
أحزاب التجمع الوطني للأحرار والأصالة والمعاصرة والاستقلال تقرر التعاون على,17 شتنبر 2021,15:32
محمد إبراهيمي عن حزب الأصالة والمعاصرة رئيسا للمجلس الجماعي لبركان,17 شتنبر 2021,15:24
الناصري :القانون لا يمنع أي شخص من أن يكون مسؤولا,17 شتنبر 2021,15:06
اهتمامات الصحف الإفريقية ..,17 شتنبر 2021,14:40
ما بعد انتخابات 8 شتنبر.. دخول سياسي برهانات كبرى,17 شتنبر 2021,14:24
انتخاب طارق العثماني عن حزب التجمع الوطني للأحرار رئيسا جديدا,17 شتنبر 2021,13:53
انتخاب السيدة فاطمة الزهراء المنصوري عن حزب الأصالة والمعاصرة رئيسة,17 شتنبر 2021,13:22
القطريون يخوضون أول انتخابات تشريعية في تاريخهم لاختيار أعضاء مجلس,17 شتنبر 2021,13:19
انتخاب سعيد كريمي عن حزب الاستقلال رئيسا للمجلس الجماعي للرشيدية,17 شتنبر 2021,12:42
إعادة انتخاب مولاي حمدي ولد الرشيد عن حزب الاستقلال رئيسا,17 شتنبر 2021,12:41
انتخاب الراغب حرمة الله رئيسا للمجلس الجماعي للداخلة,17 شتنبر 2021,12:29
انتخاب عبد الواحد المسعودي رئيسا لمجلس جماعة تازة,17 شتنبر 2021,12:27
صندوق النقد الدولي يحذر من أزمة إنسانية وشيكة في أفغانستان,17 شتنبر 2021,12:24
الأصالة والمعاصرة يفوض أمينه العام لمواصلة المشاورات حول الحكومة المقبلة,17 شتنبر 2021,12:21
الأمم المتحدة: الحوار ضروري للاستقرار والإصلاح في الصومال,17 شتنبر 2021,12:10
هولندا.. استقالة وزيرة الخارجية بسبب إدارتها لعمليات الإجلاء من أفغانستان,17 شتنبر 2021,12:08
كوريا الجنوبية والولايات المتحدة تتفقان على الحاجة الملحة إلى الحوار,17 شتنبر 2021,11:37
البيت الأبيض: الحوار الأمريكي-الروسي حول الأمن السيبراني مستمر,17 شتنبر 2021,11:21
الاهتمام المتزايد للصين وروسيا بافريقيا موضوع ندوة بفاس,17 شتنبر 2021,11:01
الدخول بفريق نيابي مشترك : حزبا الاتحاد الدستوري والحركة الديمقراطية,16 شتنبر 2021,20:29
إقامة مراسم إغلاق ثوابيت جثماني السائقين المغربيين الذين قتلا في,16 شتنبر 2021,19:39
تعيين مغربي على رأس المفوضية الإفريقية‎‎,16 شتنبر 2021,15:05
رسميا يوم غد .. انتخاب 1500 رئيس جماعة في المغرب,16 شتنبر 2021,14:43
مباحثاث قطرية ليبية لبحث سبل تعزيز العلاقات الثنائية والوضع في,16 شتنبر 2021,14:25
الخارجية الفلسطينية ..التصعيد ضد المسجد الأقصى يهدف إلى تسريع التقسيم,16 شتنبر 2021,13:35
حزب جزائري معارض يحذر من “اللجوء الممنهج للحلول الأمنية لتدبير,16 شتنبر 2021,12:57
أبرز اهتمامات الصحف المغاربية ..,16 شتنبر 2021,12:56
المواطنون في الصحراء وجدوا في الانتخابات مناسبة لتأكيد تطلعاتهم المشروعة,16 شتنبر 2021,10:25
تعيين السيد بابو سين قنصلا عاما للسنغال بالداخلة,16 شتنبر 2021,10:16
سفير المغرب بجنيف :جهة الصحراء المغربية تشهد نموا ملحوظا على,15 شتنبر 2021,22:46
تحالف فدرالية اليسار يأمل في الحكومة المقبلة القضايا الاجتماعية في,15 شتنبر 2021,18:40
اقتراع 8 شتنبر..نائب أوروبي يبرز دلالة المشاركة المكثفة لساكنة الأقاليم,15 شتنبر 2021,18:18
موريتانيا.. الإنتخابات المغربية استفتاء شعبي و تأكيد على مغربية الصحراء,15 شتنبر 2021,17:45
فيديو : أخنوش يكشف حصيلة مشاوراته لتشكيل الحكومة,15 شتنبر 2021,17:17
الطاهر بنجلون : “إسقاط العدالة والتنمية بالانتخابات تعبير حداثي”,15 شتنبر 2021,17:12
رئيس الحكومة أخنوش : الجولة الأولى من المشاورات كانت مهمة,15 شتنبر 2021,17:00
مواقع إسبانية: معطيات جديدة حول دخول “بن بطوش” إلى إسبانيا,15 شتنبر 2021,15:52
دراسة بحثية أمريكية : الأوراق الرابحة في سياسة المغرب الخارجية,15 شتنبر 2021,14:14
يومية “الصباح” :قتلة السائقين المغاربة بمالي عبروا الجزائر,15 شتنبر 2021,14:13
محاكمة عمدة مراكش السابق ونائبه تأجل إلى 13 أكتوبر القادم,15 شتنبر 2021,14:10
تعيين مبعوث أممي جديد للصحراء المغربية,15 شتنبر 2021,14:09
القيادية في البام فاطمة الزهراء المنصوري تستقطب منتخبي العدالة والتنمية,15 شتنبر 2021,13:22
حزب التقدم والإشتراكية يتجه نحو المعارضة,15 شتنبر 2021,12:14
حزب العدالة والتنمية بطنجة يقرر اللجوء إلى القضاء للطعن على,15 شتنبر 2021,12:06
رئيس الحكومة أخنوش يلتقي بأمين عام حزب الحركة الديمقراطية,15 شتنبر 2021,12:04
عبد السلام البقالي يقترب من عمودية العاصمة العلمية,15 شتنبر 2021,11:11
انتخابات : التجربة المغربية تعطي درسا كبيرا في مجال الثقة,14 شتنبر 2021,20:26
سفير المغرب بجنيف يندد بادعاءات الجزائر حول الصحراء المغربية,14 شتنبر 2021,20:19
المجلس الوطني للاتحاد الاشتراكي يجتمع الأحد المقبل لمناقشة …..,14 شتنبر 2021,17:36
ثلاثة أسئلة لسفير المغرب في بولونيا,14 شتنبر 2021,16:11
حزب الإستقلال يقدم مرشحه لرئاسة جهة الدار البيضاء,14 شتنبر 2021,15:13
اختيار عمدة روتردام الهولندية المغربي أحمد أبو طالب أفضل عمدة,14 شتنبر 2021,15:11
أخنوش يوجه الدعوة لقيادة العدالة والتنمية للقاءه غدا,14 شتنبر 2021,14:44
الرئيس الروسي يدخل عزلا ذاتيا بعد إصابة مقربين منه بفيروس,14 شتنبر 2021,13:36
صراع ثلاثي على رئاسة مجلس مدينة طنجة,14 شتنبر 2021,13:17
المجلس الأعلى للحسابات يمهل المرشحين 60 يوما لتقديم حساباتهم المصرفية,14 شتنبر 2021,12:28
ترشيح إدريس لشكر لرئاسة مجلس الرباط,14 شتنبر 2021,11:41
مالي تدين بشدة “الهجوم الجبان والهمجي” على قافلة تجارية مغربية,14 شتنبر 2021,10:39
بوريطة يدعو جنوب إفريقيا إلى تعاون أكبر و إعلاء مصالح,13 شتنبر 2021,22:27
بوريطة : حل الأزمة في ليبيا بتظافر الجهود لإنجاح الإنتخابات,13 شتنبر 2021,21:39
مشاورات تشكيل الحكومة :الاتحاد الدستوري مستعد للمساهمة,13 شتنبر 2021,18:49
مشاورات تشكيل الحكومة : تصريح ادريس لشكر -فديو-,13 شتنبر 2021,18:36
السيد أخنوش يعقد لقاء مع حزب الاتحاد الاشتراكي للقوات الشعبية,13 شتنبر 2021,18:29
السيد أخنوش يلتقي الأمين العام لحزب الحركة الشعبية,13 شتنبر 2021,18:13
وزير خارجية إسبانيا : تحسن في العلاقات بين الرباط و,13 شتنبر 2021,17:39
بروز المرأة المغربية سياسيا…ثلاث نسوة يصلن لعمودية أكبر المدن,13 شتنبر 2021,17:33
طالبان:الحركة لن تتراجع عن قرار السماح للإناث في متابعة الدراسة,13 شتنبر 2021,16:23
الإتفاق على إسناد رئاسة جهة فاس لحزب الإستقلال,13 شتنبر 2021,13:10
السيد عزيز أخنوش يستهل مشاورات تشكيل الحكومة بلقاء مع …..,13 شتنبر 2021,12:51
عاجل : بدء مشاورات تشكيل الحكومة الجديدة بالمغرب,13 شتنبر 2021,11:10
نتائج نهائية : الصدارة لحزب التجمع الوطني للأحرار بإقليم الحوز,13 شتنبر 2021,10:57
دبلوماسي أرجنتيني يعتبر إشراك المرأة في انتخابات شتنبر…,12 شتنبر 2021,12:46
واشنطن بوست: هجمات 11 سبتمبر كانت مأساة ولكن ما……,11 شتنبر 2021,22:40
تصريح الطالبي العلمي حول مشاورات التجمع الوطني للأحرار مع …..,11 شتنبر 2021,21:30
الأحرار” يؤكد استعداده للتعاون مع كل القوى السياسية الوطنية….,11 شتنبر 2021,21:26
الاتحاد الدستوري يشيد بالمجهودات الجبارة التي بذلتها ….,11 شتنبر 2021,19:00
الانتخابات الجهوية .. أربعة أحزاب في الصدارة بإقليم آسفي,11 شتنبر 2021,15:42
البرلمان العربي: الانتخابات المغربية جرت بحيادية و…,11 شتنبر 2021,11:37
بعثات دبلوماسية تشيد بنجاح الانتخابات بالمغرب,11 شتنبر 2021,11:34
أبرز عناوين الصحف المغربية لنهاية الأسبوع,11 شتنبر 2021,08:43
الملك محمد السادس يستقبل عزيز أخنوش ويعينه رئيسا للحكومة-فيديو-,11 شتنبر 2021,00:13
خبراء الأمم المتحدة : جميع الأطراف مسؤولة عن …..,11 شتنبر 2021,00:08
تصريح عزيز أخنوش بعد تعيينه من طرف الملك محمد السادس,10 شتنبر 2021,21:37
الملك محمد السادس يستقبل عزيز أخنوش ويعينه رئيسا للحكومة,10 شتنبر 2021,19:49
التجمع الوطني للأحرار و حزب الاستقلال يقتسمان مقاعد ….,10 شتنبر 2021,19:26
حزب العدالة والتنمية … والانتكاسة السياسية المدوية,10 شتنبر 2021,17:38
وزير الخارجية الكويتي:نعمل على تقريب وجهات النظر بين المغرب و…,10 شتنبر 2021,16:42
الداخلية تفتح باب الترشح لرئاسة المجالس ابتداء من السبت,10 شتنبر 2021,12:59
حزب الاستقلال يتصدر نتائج إقليم السمارة,10 شتنبر 2021,12:24
وهبي : حزب الأصالة والمعاصرة استطاع الحفاظ على مكانته,10 شتنبر 2021,11:25
كلميم : حزبا الأصالة والمعاصرة والتجمع الوطني للأحرار يتمكن…,10 شتنبر 2021,11:14
المغرب: توزيع المقاعد بعد انتهاء فرز وإحصاء الأصوات,10 شتنبر 2021,10:48
سفارة اليابان في الرباط تهنئ المغاربة بمناسبة ….,10 شتنبر 2021,02:11
انتخابات المغرب.. ملاحظ بوركينابي يشيد بالحس الوطني ال….,10 شتنبر 2021,02:02
انتخابات المغرب.. عضو في بعثة الملاحظة الفرنسية يشيد بـ…,9 شتنبر 2021,20:05
أبرز ردود الأفعال من الإعلام الدولي حول نتائج الإنتخابات المغربية,9 شتنبر 2021,18:20
الفنانة المغربية فاطمة خير تنتزع مقعدا في مجلس النواب,9 شتنبر 2021,18:16
قيادة حزب العدالة و التنمية تتقدم باستقالتها,9 شتنبر 2021,18:14
نيويورك تايمز : خسارة البيجيدي نكسة جديدة للإسلاميين,9 شتنبر 2021,15:48
حزب التجمع الوطني للأحرار مستعد للعمل مع كل الأحزاب….,9 شتنبر 2021,15:39
عدد من رؤساء الأندية الوطنية يظفرون بمقاعد في البرلمان,9 شتنبر 2021,15:04
القيادي البارز في البيجيدي لحسن الداودي يقدم استقالته,9 شتنبر 2021,15:00
خسارة مدوية : البيجيدي يفقد جميع مقاعده بالبيضاء,9 شتنبر 2021,13:14
بنكيران يدعو العثماني إلى الإستقالة من رئاسة البيجيدي,9 شتنبر 2021,13:14
العثماني و بنعبد الله يفشلان في الظفر بمقعد في البرلمان,9 شتنبر 2021,13:13
للأول مرة.. نبيلة منيب تفوز بمقعد برلماني,9 شتنبر 2021,13:13
الأقاليم الجنوبية للمملكة تسجل كعادتها أعلى نسبة مشاركة,9 شتنبر 2021,05:59
تصدر حزب التجمع الوطني للأحرار نتائج انتخابات أعضاء مجلس النواب,9 شتنبر 2021,05:05
عمدة مدينة فاس يفوز بمقعد برلماني,9 شتنبر 2021,01:13
الأمين العام للأصالة و المعاصرة يحافظ على مقعده البرلماني,9 شتنبر 2021,01:11
نتائج أولية من عمالة طنجة أصيلة.. البيجيدي يخسر مقاعده الانتخابية,9 شتنبر 2021,00:10
الأمين العام لحزب الأحرار : نسبة المشاركة مرتفعة,8 شتنبر 2021,23:28
نسبة المشاركة بإقليم الحسيمة بلغت 62ر52 في المائة,8 شتنبر 2021,22:48
العرائش ‎ : نزار بركة ينجح في نيل مقعد برلماني,8 شتنبر 2021,22:23
سفارة الولايات المتحدة بالرباط تهنئ المملكة على نجاح الانتخابات.,8 شتنبر 2021,22:09
"انتخابات 8 شتنبر نسبة المشاركة بلغت 50,18 في المائة",8 شتنبر 2021,21:54
أكادير.. وفاة شخص بالمستشفى تم ضبطه في حالة تلبس بارتكا….,8 شتنبر 2021,19:58
إقبال ملحوظ على صناديق الإقتراع في أقاليمنا الجنوبية,8 شتنبر 2021,18:56
انتخابات 8 شتنبر.. إقبال متزايد على مراكز بالدار البيضاء,8 شتنبر 2021,18:20
عاجل نسبة المشاركة : % 36 على الصعيد الوطني …,8 شتنبر 2021,17:46
نسبة التصويت بإقليم الرشيدية بلغت 16.68 في المائة في….,8 شتنبر 2021,17:05
عناوين وسائل الاعلام الدولية و العربية حول الانتخابات بالمغرب,8 شتنبر 2021,16:18
الإنتخابات :إحصائيات للناخبين المتوجهين لصناديق الاقت….,8 شتنبر 2021,15:05
مراقبة عالمية و عربية لشفافية الانتخابات بالمغرب,8 شتنبر 2021,13:19
كيف تتم عملية التصويت في ظل جائحة كورونا,8 شتنبر 2021,13:18
زعماء الأحزاب السياسية الكبرى يدلون بأصواتهم في الانتخابات,8 شتنبر 2021,13:05
عاجل : مشاركة % 12 على الصعيد الوطني …,8 شتنبر 2021,12:45
أجواء عملية التصويت : بجهة طنجة تطوان الحسيمة,8 شتنبر 2021,12:05
انطلاق عملية التصويت في الانتخابات البرلمانية والمحلية المغربية,8 شتنبر 2021,10:28
لذوي المناعة المنخفضة إسبانيا تقترح جرعة ثالثة من اللقاح,7 شتنبر 2021,22:05
بلاغ وزير الداخلية حول اعتماد البطاقة الوطنية بالانتخابات,7 شتنبر 2021,19:43
برئاسة المغرب : انطلاق الدورة 156 لمجلس جامعة الدول العربية,7 شتنبر 2021,18:36
نحو ثلاثة ملايين شخص مدعوون ليوم الاقتراع غدا …,7 شتنبر 2021,18:01
طنجة – أصيلة : 23 لائحة تتنافس على 5 مقاعد,7 شتنبر 2021,15:29
البرلمان العربي يشارك في متابعة الانتخابات بالمغرب,6 شتنبر 2021,11:22
هل وسائل التواصل الاجتماعي ستأثر على المضامين الانتخابية؟,4 شتنبر 2021,11:22
تحذيرات للأحزاب من الاستخدام غير القانوني للأرقام الهاتفية للمواطنين,4 شتنبر 2021,11:14
انتخابات شتنبر: 14 منتخبا فرنسيا في مهمة المراقبة,3 شتنبر 2021,14:52
حزب الأصالة والمعاصرة مستعد للتعاون مع كافة الأحزاب,2 شتنبر 2021,23:05
انتخابات: الدعوة إلى منح تسهيلات للأطر والموظفين والأعوان,2 شتنبر 2021,17:59
الجمعية البرلمانية لمجلس أوروبا ستراقب الانتخابات التشريعية,1 شتنبر 2021,21:36
الداخلية تلزم وكلاء اللوائح بفتح حساب بنكي خاص بالحملة الانتخابية,1 شتنبر 2021,11:16
البلدان الإفريقية تناقش تنفيذ الميثاق العالمي حول الهجرة,31 غشت 2021,18:00
سفارة المملكة بجاكرتا تنظم قنصلية متنقلة لفائدة أفراد الجالية,31 غشت 2021,16:37
افتتاح 53 مركزا لتسريع عملية تلقيح التلاميذ -كوفيد 19,30 غشت 2021,16:58
السيدة زينب كاندي قنصلا عاما لجمهورية سيراليون بالداخلة,30 غشت 2021,14:34
السيد هلال يرد على السفير الجزائري حول الانتهاكات الجسيمة في,29 غشت 2021,10:54
الموقف الرسمي للحكومة السويسرية من قضية الصحراء المغربية,28 غشت 2021,19:10
جمهورية الكونغو تشيد بالمبادرة المغربية للحكم الذاتي,27 غشت 2021,22:43
ألكسندر إيفانكو ممثلا خاصا للأمين العام للأمم المتحدة للصحراء,27 غشت 2021,22:40
انتخاب أعضاء مجالس الجهات.. تقديم 1123 لائحة ترشيح,27 غشت 2021,18:11
التعاون الخليجي يدعو المغرب والجزائر إلى الحوار,27 غشت 2021,18:03
كوت ديفوار تأكد دعمها لمبادرة الحكم الذاتي المغربية,27 غشت 2021,14:58
تدشين سفارة سيراليون بالرباط,27 غشت 2021,14:42
المغرب يغلق سفارته في الجزائر,27 غشت 2021,14:39
سيراليون تدعم مشروع خط أنبوب الغاز بين نيجيريا والمغرب,26 غشت 2021,21:49
جمهورية سيراليون ستفتح قنصلية عامة لها بالداخلة يوم الاثنين,26 غشت 2021,21:00
خبر تعرض مرشح ورئيس جماعة سابق لجريمة قتل عار عن,26 غشت 2021,20:51
خبير إسباني:الجزائر تقطع علاقتها الدبلوماسية مع المغرب,26 غشت 2021,18:28
افتتاح سفارة سيراليون بالرباط وقنصلية في الداخلة,26 غشت 2021,17:44
الامم المتحدة تدعو المغرب والجزائر لإصلاح علاقتهما,26 غشت 2021,15:56
تفاصيل البرنامج الانتخابي لحزب الأصالة والمعاصرة,26 غشت 2021,15:04
العثماني: ترشحي للاستحقاقات المقبلة ليس قرارا شخصيا,26 غشت 2021,14:37
الجزائر تبحث عن“كبش فداء” بتصعيدها ضد المغرب,26 غشت 2021,14:31
انطلاق الحملة الانتخابية : اقتراع 8 شتنبر,26 غشت 2021,11:49
أكثر من 4500 ملاحظ للحملة الانتخابية,25 غشت 2021,22:12
انتهاء فترة إيداع الترشيحات للانتخابات التشريعية بالمغرب,25 غشت 2021,16:24
منظمة التعاون الإسلامي تدعو الجزائر والمغرب إلى الحوار,25 غشت 2021,15:58
ساجد يترشح لعضوية جهة الدارالبيضاء سطات,25 غشت 2021,15:31
بوريطة: الانتخابات الليبية 2021 ستحسم مسألة الشرعية,25 غشت 2021,15:17
الصحراء المغربية: مدغشقر تجدد دعمها للمملكة,24 غشت 2021,23:17
الجزائر تعلن قطع علاقاتها الدبلوماسية مع المغرب,24 غشت 2021,17:59
استئناف العلاقات بين المغرب وإسرائيل قرار “طبيعي”,24 غشت 2021,16:30
المغرب يصادق على تقنين زراعة القنب الهندي,23 غشت 2021,18:54
“فرونتكس” تؤكد أن المغرب شريك قوي للاتحاد الأوروبي,23 غشت 2021,17:22
