Ligne précédente,Date,Heure
المجلس الوطني لحزب الاتحاد الاشتراكي للقوات الشعبية يعقد دورته العادية,27 يناير 2024,15:55
التعاون الاقتصادي محور مباحثات السيد الجزولي ووزير الصناعة والتجارة الاسباني,22 ماي 2023,22:57
فاتح ماي 2023: حزب التقدم والاشتراكية يدعو إلى حماية القدرة,1 ماي 2023,12:22
السيد لقجع: جولة أبريل من الحوار الاجتماعي تتناول الأوضاع الإقتصادية,14 أبريل 2023,17:07
يونس السكوري: الحكومة أوفت بعدد كبير من التزاماتها رغم الظرفية,14 أبريل 2023,17:02
المجلس الأعلى للحسابات: تراجع نصف الأحزاب السياسية المغربية في تبرير,16 مارس 2023,19:30
مضامين بلاغ حزب العدالة والتنمية المثير ل(غضب) القصر الملكي,13 مارس 2023,16:16
معرض بورصة برلين للسياحة الدولية: لقاء مغربي ألماني للترويج للسياحة,8 مارس 2023,21:33
أخنوش: الحكومة ماضية في تنزيل التزاماتها في قطاعات الصحة والتعليم,26 فبراير 2023,23:27
السيد أوزين: تجديد الخطاب السياسي وتأهيله للأجيال الجديدة أولى مهام,4 فبراير 2023,18:15
بعثة نادي الأهلي المصري تحط الرحال بالمغرب,28 يناير 2023,23:47
ادريس لشكر: موقف البرلمان الأوروبي يعكس انزعاج بعض الأطراف من,28 يناير 2023,16:47
عبد اللطيف وهبي يحل غدا الثلاثاء ضيفا على ملتقى وكالة,23 يناير 2023,10:44
مجلس المستشارين: لجنة المالية والتخطيط تصادق على مشروع قانون المالية,3 دجنبر 2022,21:40
السيد أخنوش: الانخراط في مسلسل مأسسة الحوار الاجتماعي سيساهم في,29 نونبر 2022,20:22
جلالة الملك يهنئ السيد محمد أوزين بمناسبة انتخابه أمينا عاما,28 نونبر 2022,20:02
السيد العنصر: المؤتمر الوطني الرابع عشر للحركة الشعبية محطة مفصلية,25 نونبر 2022,22:51
حزب الحركة الشعبية .. فتح باب الترشح للأمانة العامة,19 نونبر 2022,22:32
حزب الأصالة والمعاصرة يجمد عضوية النائب هشام المهاجري,14 نونبر 2022,21:18
نبيل بنعبد الله أمينا عاما لحزب التقدم والاشتراكية لولاية رابعة,12 نونبر 2022,22:48
حزب الحركة الشعبية ينظم لقاءا تكوينيا لفائدة مستشارات الجماعات الترابية,12 نونبر 2022,15:10
بنك إفريقيا يطلق سلسلة من اللقاءات حول إزالة الكربون,1 نونبر 2022,09:56
نائب بنكيران يستقيل من أمانة البيجيدي,28 أكتوبر 2022,22:16
السيد أخنوش يؤكد عزم الحكومة على استكمال تنفيذ برنامجها من,27 أكتوبر 2022,19:02
مشروع قانون المالية 2023 : انعقاد اجتماع هيئة رئاسة الأغلبية,27 أكتوبر 2022,11:28
إعادة انتخاب عبد الصمد عرشان أمينا عاما لحزب الحركة الديمقراطية,8 أكتوبر 2022,16:09
انتخاب محمد جودار أمينا عاما جديدا لحزب الاتحاد الدستوري,1 أكتوبر 2022,22:15
الحصيلة الوبائية بالمغرب : تسجيل 4 إصابات جديدة مقابل تعافي,26 شتنبر 2022,16:51
الدخول السياسي الجديد .. رهانات وتحديات تواجه الأحزاب خلال السنة,21 شتنبر 2022,13:02
عادل الصغير كاتبا وطنيا جديدا لشبيبة العدالة والتنمية,18 شتنبر 2022,10:09
الحوار الاجتماعي 2022 : السيد عزيز أخنوش يشرف على انطلاق,14 شتنبر 2022,22:23
حزب الحركة الشعبية يطالب بعقد لقاءٍ بمجلس النواب لتدارس واقع,3 شتنبر 2022,18:03
حزب الاتحاد الدستوري يشيد عالياً بما ورد في الخطاب الملكي,26 غشت 2022,16:26
السيد عزيز أخنوش يدعو إلى التعبئة الشاملة من أجل تفعيل,24 غشت 2022,21:01
حزب الأصالة والمعاصرة يشيد بالمكاسب الدبلوماسية الداعمة لقضية الصحراء المغربية,24 غشت 2022,20:16
المحكمة الدستورية تحسم في الطعون المتعلقة بانتخاب أعضاء مجلس النواب,1 غشت 2022,15:07
حزب التقدم والاشتراكية يشيد بالتوجهات المتقدمة لمضامين الخطاب الملكي,1 غشت 2022,14:58
المحكمة الدستورية تعلن فوز عبد الرحيم بوعيدة ورجوعه لمجلس النواب,29 يوليوز 2022,16:50
راشيد الطالبي العلمي : تصريحاتي حرفتها أطراف سياسية لتضليل المغاربة,28 يوليوز 2022,21:23
"لجنة الاستثمارات تصادق على 8 مشاريع بقيمة 5,7 مليار درهم",28 يوليوز 2022,21:22
الحكومة تصادق على مرسوم بخصوص إحداث السجل الوطني الفلاحي,27 يوليوز 2022,15:13
التجمع الوطني للأحرار يعقد مؤتمره الجهوي لجهة الشرق,25 يوليوز 2022,09:11
توقيع مذكرة تفاهم بين وزارة العدل ووزارة الانتقال الرقمي وإصلاح,23 يوليوز 2022,09:26
أحزاب التجمع الوطني للأحرار والأصالة والمعاصرة والاستقلال والاتحاد الاشتراكي تتقاسم,21 يوليوز 2022,23:30
أنيس بيرو : حكومة أخنوش تتعرض للتشويش,18 يوليوز 2022,08:31
أعضاء المكتب السياسي لحزب التجمع الوطني للأحرار يؤكدون دعمهم اللامشروط,17 يوليوز 2022,00:15
حزب التجمع الوطني للأحرار 2022 : فعاليات المؤتمر الجهوي للحزب,16 يوليوز 2022,23:44
اتساع رقعة حريق غابة “آل سريف” بإقليم العرائش والتعبئة مستمرة,16 يوليوز 2022,19:33
المؤتمر الوطني ال11 لحزب التقدم والاشتراكية : محطة سياسية نوعية,21 يونيو 2022,22:12
مجلس النواب : السيدة المنصوري تؤكد ضرورة إعادة النظر في,20 يونيو 2022,22:25
المؤتمر الوطني لحزب التقدم والاشتراكية 2022 : السيد نبيل بنعبد,18 يونيو 2022,20:12
بلاغ مجلس النواب : جلسة عمومية غدا تخصص للأسئلة الشفهية,12 يونيو 2022,14:34
كوفيد 19 .. تسجيل 233 إصابة جديدة دون أي وفيات,6 يونيو 2022,16:55
برقية تهنئة من جلالة الملك الى السيد تيدروس أدانوم غيبريسيس,26 ماي 2022,20:57
السيد فوزي لقجع : المغرب استطاع حصر معدل التضخم في,17 ماي 2022,00:15
تقديم أعمال المجلس الأعلى للحسابات الأربعاء المقبل أمام مجلسي البرلمان,4 ماي 2022,23:24
الأغلبية الحكومية تؤكد تعبئتها لحماية المواطنين من انعكاسات الظرفية الدولية,9 أبريل 2022,09:08
دعوة الفرنسيين المقيمين بالخارج للتصويت خلال الانتخابات الرئاسية,22 مارس 2022,12:05
عبد الوافي الفتيت يحذر المنتخبين من تضارب المصالح,22 مارس 2022,11:02
انتخاب السيد منير ليموري رئيسا جديدا للجمعية المغربية لرؤساء مجالس,19 مارس 2022,19:22
حزب التجمع الوطني للأحرار يثمن موقف إسبانيا المتعلق بالصحراء المغربية,19 مارس 2022,11:30
على خلفية أحداث الشغب .. الشرطة القضائية تحيل 70 شخصا,16 مارس 2022,17:04
مذكرة تفاهم بين مجلس المستشارين ومجلس الشيوخ بغينيا الاستوائية,6 مارس 2022,10:58
البيان الختامي للمؤتمر الوطني لحزب التجمع الوطني للأحرار,5 مارس 2022,16:55
المؤتمر الوطني السابع لحزب التجمع الوطني للأحرار ينطلق اليوم بالرباط,4 مارس 2022,18:16
مؤتمر الأحرار : عزيز أخنوش المرشح الوحيد,4 مارس 2022,14:11
مايك بنس يزور الرباط لتعزيز الاتفاق المغربي الأمريكي الإسرائيلي,18 فبراير 2022,11:34
الإنفصالية سلطانة خيا ترفض استقبال وفد المجلس الوطني لحقوق الإنسان,15 فبراير 2022,13:52
تسجيل 969 إصابة و19 وفاة جديدة بـكورونا في 24 ساعة,12 فبراير 2022,17:12
ادريس لشكر كاتبا أول لحزب الاتحاد الاشتراكي للقوات الشعبية للمرة,29 يناير 2022,18:59
أشغال المؤتمر الوطني للتصويت على الكاتب الاول للاتحاد الاشتراكي للقوات,29 يناير 2022,16:49
مجلس النواب : جلسة عمومية للأسئلة الشفهية حول السياسة العامة,27 يناير 2022,11:49
ناصر بوريطة يتباحث مع الأمين العام لمجلس التعاون لدول الخليج,26 يناير 2022,13:24
ليلى بنعلي تهدف لرفع الطموحات في مجال الطاقات المتجددة,25 يناير 2022,21:03
السيد ناصر بوريطة يتباحث مع نظيره الكمبودي,25 يناير 2022,15:52
انعقاد مجلس الحكومة يوم الخميس المقبل لدراسة خمسة مشاريع,24 يناير 2022,17:07
مجلس الحكومة .. يصادق على مشروع مرسوم بخصوص قطاع المالية,20 يناير 2022,14:52
سياسة الحكومة بخصوص تنزيل البرنامج الحكومي ” أوراش ”,18 يناير 2022,18:34
انعقاد مجلس الحكومة يوم الخميس المقبل حول إطلاق علامة “المغرب,17 يناير 2022,12:22
تحديات و إكراهات مجلس الأمن سنة 2022,14 يناير 2022,14:00
ناصر بوريطة و عمر هلال يتباحثان مع دي ميستورا المبعوث,13 يناير 2022,15:21
الحكومة تصادق على تعيينات في مناصب عليا,13 يناير 2022,14:54
برنامج أوراش: فرصة لغير المتعلمين و غير الحاصلين على شهادات,12 يناير 2022,13:49
الأمين العام لحزب الاستقلال : ذكرى تقديم وثيقة المطالبة بالاستقلال,12 يناير 2022,12:41
سفير المغرب بنشعبون يقدم أوراق اعتماده إلى السلطات الفرنسية,11 يناير 2022,16:25
نزار بركة: العمل على مجموعة من المشاريع للمحافظة على المياه,6 يناير 2022,15:00
انعقاد مجلس الحكومة بعد غد الخميس للبحث في اختصاصات وزارة,4 يناير 2022,10:24
رئيس الحكومة يوم الثلاثاء بمجلس المستشارين,31 دجنبر 2021,13:17
مجلس الحكومة يصادق على مقترحات تعيين في مناصب عليا,30 دجنبر 2021,17:07
السيد سكوري: المقاولات مدعوة لوضع التدابير الوقائية الموصى بها,29 دجنبر 2021,12:00
وزير العدل يدعو المحامين إلى الالتزام بالإدلاء بجواز التلقيح قبل,29 دجنبر 2021,09:24
السيد لفتيت..يطالب بالاستثمارات العمومية للحد من الفوارق المجالية والاجتماعية,28 دجنبر 2021,19:47
وزيرة السياحة تتعهد بإدماج المطاعم السياحية ضمن التدابير الاستعجالية,28 دجنبر 2021,17:32
مجلس النواب يتقلص حضور البرلمانيين بسبب المتحور أوميكرون,28 دجنبر 2021,11:49
السيد أخنوش:مشاركة المغرب في إكسبو دبي 2020 تعبر عن التزام,26 دجنبر 2021,15:30
المغرب يرحب بالتطورات الجديدة في العلاقات مع ألمانيا,23 دجنبر 2021,16:27
مجلس الحكومة يصادق على مشاريع مراسيم جديدة,23 دجنبر 2021,14:11
استمرار المغرب في حل النزاعات الدولية رغم الاتفاق الثلاثي المغربي-الأمريكي-الإسرائيلي,22 دجنبر 2021,19:34
السياسة الأمريكية تجاه المغرب في ما يتعلق بالصحراء المغربية,22 دجنبر 2021,17:56
استئناف التعاون الثنائي بين المغرب وألمانيا,22 دجنبر 2021,15:53
حالة الطوارئ الصحية ضمن برنامج اجتماع مجلس الحكومة بعد غد,21 دجنبر 2021,09:57
رغبة ألمانيا في عودة العلاقات مع المغرب إلى سابق عهدها,18 دجنبر 2021,17:13
مباحثات بين المغرب والمكسيك لتعزيز التعاون في مجال النقل الجوي,17 دجنبر 2021,20:34
الرباط و واشنطن شراكة استراتيجية نحو المستقبل,17 دجنبر 2021,13:23
السيد بوريطة يستعرض مشاريع قوانين تسع اتفاقيات دولية,15 دجنبر 2021,19:07
هشام العلوي ، سفير جلالة الملك لدى جمهورية كوبا,15 دجنبر 2021,12:15
نبذة عن السفير الجديد لجلالة الملك لدى المملكة المتحدة لبريطانيا,15 دجنبر 2021,11:46
الثقة الملكية السامية حافز قوي على المساهمة في إشعاع المغرب,15 دجنبر 2021,11:34
نبذة عن السيد محمد بنشعبون، السفير الجديد لجلالة الملك لدى,15 دجنبر 2021,09:50
تصور استشرافي و استباقي للسياسة الحضرية و سياسة المدينة,14 دجنبر 2021,19:51
دور البرلمان في إعادة البناء بشكل أفضل للجميع,14 دجنبر 2021,12:10
وسيط المملكة… إرضاء المرتفقين أولوية بالنسبة للإدارة العمومية المغربية,14 دجنبر 2021,10:48
دافيد جوفرين في زيارة للعاصمة العلمية و الروحية,14 دجنبر 2021,09:40
مواجهة بين وهبي و أوزين حول اللغة الأمازيغية ورائحة “التقاشر”,13 دجنبر 2021,18:19
وهبي..الرقمنة سبيل الإرتقاء بوزارة العدل,13 دجنبر 2021,17:55
استقبال ناصر بوريطة لسفراء جدد,13 دجنبر 2021,16:24
رئيس كوريا الجنوبية…. إعلان إنهاء الحرب بين “الكوريتين”,13 دجنبر 2021,10:09
ايت الطالب…. تعميم الحماية الإجتماعية المشمولة بالعناية الملكية السامية,11 دجنبر 2021,12:45
بداية الإنتخابات الفلسطينية المحلية بالضفة الغربية,11 دجنبر 2021,12:33
حزب التجمع الوطني للأحرار نحو تنمية إجتماعية شاملة,11 دجنبر 2021,11:39
وزير الخارجية الروسي يلغي زيارته إلى المغرب والجزائر,10 دجنبر 2021,22:17
مصادقة المجلس الحكومي على مقترحات تعيين في مناصب عليا,9 دجنبر 2021,18:09
عاجل: عرض إسرائيلي لتكوين 5000 مهندس مغربي في التكنولوجيا الدقيقة,9 دجنبر 2021,17:15
المصادقة على مرسوم يهم المتضررين من تداعيات فيروس كورونا,9 دجنبر 2021,15:36
لقاء الطالبي العلمي وسفيرة فرنسا بالمغرب لتعزيز التعاون البرلماني الثنائي,8 دجنبر 2021,15:12
الوكالة الفرنسية للتنمية تمنح المغرب 200 مليون أورو لدعم الحماية,7 دجنبر 2021,22:42
مجلس النواب يصادق بالأغلبية على مشروع قانون المالية برسم سنة,6 دجنبر 2021,19:42
استضافة المغرب للاجتماع المقبل لمجلس وزراء العدل العرب,6 دجنبر 2021,17:15
السيد هلال يندد بتجنيد الجماعات المسلحة للأطفال,6 دجنبر 2021,17:02
الأحزاب المكونة للحكومة توقع على ميثاق الأغلبية,6 دجنبر 2021,15:49
انعقاد مجلس الحكومة يوم الخميس لدراسة تطورات الجائحة على المستوى,6 دجنبر 2021,10:55
تونس … أول حالة من سلالة “أوميكرون” الجديدة,3 دجنبر 2021,18:11
تفاصيل لقاء جازولي مع المنسقة المقيمة لمنظومة الأمم المتحدة بالمغرب,3 دجنبر 2021,12:24
بوريطة يؤكد أن المغرب ملتزم بدعم عمل مجموعة أصدقاء البلدان,2 دجنبر 2021,21:19
المصادق على مشروع قانون اتفاقية التلاعب بالمسابقات الرياضية,2 دجنبر 2021,16:00
مجلس المستشارين: ثلاث جلسات عمومية للتصويت على مشروع قانون المالية,2 دجنبر 2021,12:02
تحديد الفترة المخصصة لتقديم طلبات التسجيل في اللوائح الانتخابية,1 دجنبر 2021,19:13
المصادقة على الجزء الأول من مشروع قانون المالية لسنة 2022,1 دجنبر 2021,14:00
المصادقة على 5 مشاريع استثمارية بنحو 4 ملايير درهم,30 نونبر 2021,22:23
ناصر بوريطة يدعو إلى التضامن في الأزمة الصحية الحالية,30 نونبر 2021,21:31
وزارة العدل تدرس تطوير السياسة الجنائية بالمغرب,30 نونبر 2021,18:58
دراسة قانون إحداث السجل الوطني الفلاحي بمجلس الحكومة المقبل,29 نونبر 2021,12:29
الاتحاد البرلماني الدولي : السيد ميارة يجري مباحثات مع رؤساء,28 نونبر 2021,12:11
قضية الوحدة الترابية للمملكة في مقدمة انشغالات وأولويات حزب الاستقلال,27 نونبر 2021,23:16
تصعيد روسي وتأهب أمريكي بعد تحذير من غزو أوكرانيا,27 نونبر 2021,11:29
السيد أخنوش يؤكد أن الاستثمار يشكل أولوية,25 نونبر 2021,15:49
برنامج تكوين المنتخبين الجدد للجماعات الترابية,24 نونبر 2021,21:56
رئيس الحكومة يترأس اجتماع لجنة الاستثمارات,23 نونبر 2021,18:04
شيلي : الناخبون مدعوون للاختيار بين مرشحين من أقصى اليسار,22 نونبر 2021,18:00
حالة الطوارئ الصحية ضمن برنامج انعقاد مجلس الحكومة الخميس المقبل,22 نونبر 2021,13:10
المغرب يزيل آلاف الألغام المزروعة من قبل ميليشيات انفصالية,19 نونبر 2021,14:23
الصين تتهم الولايات المتحدة بـ تسييس الرياضة بعد التهديد بمقاطعة,19 نونبر 2021,11:10
استماع مجلس الحكومة إلى عرض قدمه السيد فوزي لقجع,17 نونبر 2021,16:52
إحداث نظام للمعاشات الخاصين بفئات المهنيين والعمال المستقلين,17 نونبر 2021,14:52
مباحثات بوريطة مع مفوض الاتحاد الإفريقي للشؤون السياسية,16 نونبر 2021,16:25
بنموسى يجتمع بالنقابات التعليمية,16 نونبر 2021,15:10
أوسمة ملكية لموظفي مجلس المستشارين,15 نونبر 2021,19:17
طائرات مسيرة فوق سماء الصحراء المغربية,15 نونبر 2021,17:12
الحكومة ترفض فرض ضريبة على الثروة,15 نونبر 2021,14:10
الحماية الاجتماعية صلب موضوع نقاش لمجلس الحكومة ليوم الأربعاء المقبل,15 نونبر 2021,13:04
النمسا تفرض حجرا على غير الملقحين,14 نونبر 2021,14:36
الموافقة على 31 تعديلا في مشروع قانون المالية 2022,13 نونبر 2021,22:57
وزيرة الاقتصاد والمالية تأكد أن تموين الأسواق يتم في أحسن,12 نونبر 2021,18:46
مجلس جهة طنجة تطوان الحسيمة يصادق على مشروع ميزانية 2022,12 نونبر 2021,16:32
السيد ناصر بوريطة يمثل جلالة الملك في مؤتمر باريس الدولي,12 نونبر 2021,16:13
وهبي يقول أنه سيتقدم بملتمس من أجل العفو عن معتقلي,12 نونبر 2021,15:45
الجزائر تتحكم في البوليساريو من أجل المساس بالمغرب حسب خبير,12 نونبر 2021,14:36
الإعلان عن موعد المؤتمر الوطني العادي لحزب التجمع الوطني للأحرار,12 نونبر 2021,09:30
حزب التقدم والاشتراكية يندد بأسلوب الحكومة في التعامل مع الأوضاع,11 نونبر 2021,19:52
استمرار متابعة النقيب والوزير السابق محمد زيان في حالة سراح,11 نونبر 2021,17:22
اعتقال المحامي محمد زيان وتقديمه أمام وكيل الملك اليوم,11 نونبر 2021,16:28
اتفاق على إحداث مقر الاتحاد الإفريقي للشباب بالرباط,11 نونبر 2021,14:54
لجنة تابعة للأمم المتحدة.. تؤكد على الوصول الى حل للنزاع,11 نونبر 2021,14:00
افتتاح قنصليتين فخريتين للمغرب بكوريا الجنوبية,11 نونبر 2021,13:52
مندوب المغرب في الأمم المتحدة ينهي فترة رئاسته للجنة نزع,11 نونبر 2021,13:11
البرلمان يعقد السبت المقبل جلستين عموميتين لمناقشة مشروع قانون المالية,11 نونبر 2021,12:22
جلستين عموميتين بمجلس النواب لمناقشة مشروع قانون المالية والتصويت عليه,10 نونبر 2021,19:35
المغرب منخرط في تعزيز ثقافة الحوار عند معالجة الخلافات عكس,8 نونبر 2021,23:10
قمة أكرا: الدعوة الى احترام الجدول الزمني للمرحلة الانتقالية في,8 نونبر 2021,12:20
الخطاب الملكي جدد التأكيد على أن مغربية الصحراء لا نقاش,7 نونبر 2021,21:54
عزيز أخنوش .. الخطاب الملكي السامي تميز بالوضوح والصراحة والصرامة,7 نونبر 2021,13:22
الخطاب الملكي أكد على الدينامية الصريحة التي تعرفها قضية الصحراء,7 نونبر 2021,09:56
المسيرة الخضراء ليست حدثا لحظيا بل هي فلسفة تلهم الأمة,6 نونبر 2021,21:31
جمعية مغربية ترفع دعوة قضائية دولية ضد الجزائر لمطالبة بتعويضات,4 نونبر 2021,22:55
موسم أصيلة: تحقيق انتقال ديموقراطي سلس بالعالم رهين بضمان التعددية,4 نونبر 2021,19:12
مجلس الحكومة يصادق على ثلاثة مشاريع مراسيم تتعلق بقطاع الاقتصاد,4 نونبر 2021,17:24
بسبب حالة التنافي … المحكمة الدستورية تصرح بشغور مقاعد 6,4 نونبر 2021,13:28
لفتيت :الاستحقاقات الانتخابية للسنة الجارية محطة تاريخية بامتياز في مسار,3 نونبر 2021,19:15
مجلس المستشارين يعبر عن تعبئته الدائمة للدفاع عن المصالح العليا,2 نونبر 2021,17:06
وزير الصناعة: المنتجات المغربية ذات جودة عالية وفي متناول جميع,2 نونبر 2021,15:48
الأمم المتحدة.. جمهورية غينيا تشيد بالجهود الجادة للمغرب لقضية الصحراء,2 نونبر 2021,10:11
الملك محمد السادس يدعو إلى الالتزام والإنصاف اتجاه فئة واسعة,1 نونبر 2021,18:55
عمدة الرباط تدعو بمصر لبلورة نموذج اقتصادي جديد كفيل برفع,1 نونبر 2021,17:12
انعقاد مجلس الحكومة يوم الخميس المقبل,1 نونبر 2021,15:25
السيد عزيز أخنوش يترأس الوفد المغربي المشارك في مؤتمر كوب,31 أكتوبر 2021,17:34
جلالة الملك يهنئ السيد عبد الإله ابن كيران بمناسبة انتخابه,31 أكتوبر 2021,17:18
عاجل : عبد الإله ابن كيران أمينا عاما لحزب العدالة,30 أكتوبر 2021,21:30
