Ligne précédente,Date,Heure
توقعات أحوال الطقس اليوم الجمعة,13 يناير 2023,08:56
المعرض الجهوي للصناعة التحويلية الفلاحية 2023 : تنظيم المعرض الثاني,12 يناير 2023,13:07
توقعات أحوال الطقس اليوم الخميس,12 يناير 2023,09:36
أندري أزولاي : المغرب مؤتمن على التعددية كإحدى خصوصياته الرئيسية,11 يناير 2023,22:32
ملتقى وطني بتطوان حول دور اليهود المغاربة في إغناء الذاكرة,11 يناير 2023,20:26
موسم فقراء إداولتيت تزنيت : انطلاق فعاليات الدورة الأولى للتظاهرة,11 يناير 2023,15:40
برنامج روبوتيزم : يعبد الطريق للتلاميذ التوحديين بتطوان نحو الروبوتيك,11 يناير 2023,11:37
توقعات أحوال الطقس اليوم الأربعاء,11 يناير 2023,09:45
ورزازات.. اجتماع لتتبع وتنفيذ اتفاقيات شراكة لتنويع وتنشيط العرض السياحي,10 يناير 2023,13:56
المجلس الإقليمي لتازة يتدارس في دورته العادية مجموعة من القضايا,10 يناير 2023,11:26
حادثة سير تودي بحياة الوكيل العام الأسبق حسن مطر,10 يناير 2023,10:57
توقعات أحوال الطقس اليوم الثلاثاء,10 يناير 2023,09:00
طنجة : ترميم فندق الشجرة سيحيي هندسته الأصلية ويدمجه في,9 يناير 2023,11:43
توقعات أحوال الطقس اليوم الإثنين,9 يناير 2023,09:08
العيون.. الدعوة إلى تحسين الصحة المدرسية والجامعية,8 يناير 2023,18:15
سباق الغابة الدبلوماسية 2023 : الإثيوبيان تيديشا وجيداي يفوزان باللقب,8 يناير 2023,15:59
توقعات أحوال الطقس اليوم الأحد,8 يناير 2023,09:51
عمالة طنجة-أصيلة : انطلاق تسليم الدعم لفائدة المستفيدات من برنامج,7 يناير 2023,22:23
أمن العيون :توقيف شرطيين يشتبه تورطهما في قضية عنف ضد,7 يناير 2023,21:43
كلميم: اللجنة الجهوية لحقوق الإنسان تعقد اجتماعها العادي الثالث برسم,7 يناير 2023,19:19
"هزة أرضية ثانية بقوة 4,4 درجات في الحسيمة",7 يناير 2023,16:51
"تسجيل هزة أرضية بقوة 4,7 درجات في منطقة الريف",7 يناير 2023,09:44
توقعات أحوال الطقس اليوم السبت,7 يناير 2023,09:23
القافلة الجهوية المستدامة للتكتل الصناعي للطاقات المتجددة : الداخلة تحتضن,6 يناير 2023,19:36
اللجنة الجهوية للتنسيق الإحصائي تجتمع بمدينة طنجة,6 يناير 2023,13:02
توقعات أحوال الطقس اليوم الجمعة,6 يناير 2023,08:42
إنجاز 335 مشروعا بدعم من المبادرة الوطنية للتنمية البشرية بإقليم,5 يناير 2023,19:22
البحرية الملكية تقدم المساعدة لزورق شراعي فرنسي في عرض ساحل,5 يناير 2023,18:33
الغرفة الفلاحية بأكادير تنظم لقاء حول مشروع تنمية شارة إيكولوجية,5 يناير 2023,12:50
جامعة ابن زهر بأكادير وجامعة Polytechnique الفرنسية تعززان تعاونهما المشترك,5 يناير 2023,12:31
انعقاد الدورة ال22 من أيام البحث العلمي بالعرائش بالكلية المتعددة,4 يناير 2023,17:15
المجلس الجماعي لتزنيت يصادق على مشروع برنامج عمل الجماعة 2023-2028,3 يناير 2023,22:16
بني ملال: إطلاق دراسة لتنزيل برنامج مواكبة المستثمرين المغاربة المقيمين,3 يناير 2023,21:42
فاس.. لقاء تواصلي يتدارس سبل الارتقاء بأنشطة الحياة المدرسية بالمؤسسات,3 يناير 2023,12:21
توقعات أحوال الطقس اليوم الثلاثاء,3 يناير 2023,09:02
السيدة وفاء شاكر مديرة جديدة للأكاديمية الجهوية للتربية والتكوين لجهة,2 يناير 2023,21:33
وزير الفلاحة : تهيئة الأقطاب الفلاحية بكل من مكناس وبركان,2 يناير 2023,19:40
رئيس غرفة التجارة و الصناعة و الخدمات لسوس ماسة يتباحث,2 يناير 2023,18:44
ترقية والي أمن طنجة السيد عبد الكبير فرح,2 يناير 2023,16:44
24 مليون درهم لتهيئة وتقوية بنيات الشوارع بمدينة طنجة,2 يناير 2023,12:55
توقعات أحوال الطقس اليوم الاثنين,2 يناير 2023,09:34
مراكش.. أمسية للاحتفاء بتنوع الفولكلور في افتتاح الملتقى الوطني التاسع,1 يناير 2023,15:33
احتفالات رأس السنة بمراكش.. في صلب إحدى المهام الدقيقة للمديرية,1 يناير 2023,10:33
توقعات أحوال الطقس اليوم الأحد,1 يناير 2023,08:35
الصحيفة الأمريكية نيويورك تايمز تبرز سحر مدينة الصويرة,31 دجنبر 2022,21:23
والي أمن طنجة .. استعدادات وخطط أمنية ذات خصوصية لتأمين,31 دجنبر 2022,20:45
الداخلة : السيد شكيب بنموسى يقوم بزيارة مؤسستين تعليميتين,31 دجنبر 2022,19:03
مراكش آسفي.. القطاع السياحي يستعيد حيويته في 2022,31 دجنبر 2022,17:53
فتح باب الاستثمار بمنطقة الأنشطة الاقتصادية بأصيلة,31 دجنبر 2022,16:24
والي أمن طنجة .. استعدادات وخطط أمنية ذات خصوصية لتأمين,31 دجنبر 2022,20:45
الداخلة : السيد شكيب بنموسى يقوم بزيارة مؤسستين تعليميتين,31 دجنبر 2022,19:03
مراكش آسفي.. القطاع السياحي يستعيد حيويته في 2022,31 دجنبر 2022,17:53
فتح باب الاستثمار بمنطقة الأنشطة الاقتصادية بأصيلة,31 دجنبر 2022,16:24
تطوان : الأكاديمية الجهوية للتربية والتكوين تنظم لقاء جهوياً حول,31 دجنبر 2022,15:05
العرائش تحتضن ورشة تحسيسية لفائدة التجار حول المستجدات الضريبية لسنة,31 دجنبر 2022,14:27
الأكاديمية الجهوية للتربية والتكوين لجهة الدار البيضاء تتعقّب آثار العنف,31 دجنبر 2022,11:49
السيد محمد صديقي يشرف على إطلاق عدد من مشاريع التنمية,31 دجنبر 2022,11:05
الدار البيضاء : تدشين ثلاثة مشاريع تنموية بمقاطعة المعاريف,31 دجنبر 2022,10:33
توقعات أحوال الطقس اليوم السبت,31 دجنبر 2022,09:03
بوعرفة : تسليم شهادات ملكية لذوي حقوق شهداء الوحدة الترابية,30 دجنبر 2022,21:52
تنظيم قافلة طبية بالمركز الاستشفائي الإقليمي ابن باجة بتازة,30 دجنبر 2022,20:35
معرض DV EXPO .. فرصة لتسليط الضوء على أحدث الابتكارات,30 دجنبر 2022,18:28
اللجنة الجهوية لبرنامج فرصة تعقد اجتماعها الثاني بمراكش,30 دجنبر 2022,15:09
التدابير المتخذة لضمان التزود بالماء محور اجتماع بمراكش,30 دجنبر 2022,15:02
مقاييس التساقطات المطرية المسجلة بالمملكة المغربية,30 دجنبر 2022,14:23
طنجة تستضيف الدورة الثانية من سباق الغابة الدبلوماسية 10 كلم,30 دجنبر 2022,12:26
انقلاب سيارة لنقل العاملات والعمال الزراعيين باشتوكة أيت باها,30 دجنبر 2022,11:46
مطار فاس سايس يحتل المرتبة الخامسة على مستوى حركة النقل,30 دجنبر 2022,11:04
مجلس جهة بني ملال يصادق على مخطط التنمية الجهوية,30 دجنبر 2022,10:15
توقعات أحوال الطقس اليوم الجمعة,30 دجنبر 2022,08:58
إطلاق 12 غزالا بربريا بالمنتزه الوطني لإفران,29 دجنبر 2022,22:57
مكناس تحتضن الملتقى الدولي للفلاحة خلال شهر ماي المقبل,29 دجنبر 2022,22:34
الرشيدية : تخليد الذكرى الـ89 لمعركة جبل بادو بتافيلالت,29 دجنبر 2022,13:59
انعقاد الدورة العادية للجمعية العامة لمجلس الغرفة الفلاحية لجهة سوس,29 دجنبر 2022,12:24
جهة الشرق شهدت انتعاشاً للنشاط السياحي خلال سنة 2022,29 دجنبر 2022,11:58
التساقطات المطرية الأخيرة تنعش آمال الفلاحين بجهة فاس مكناس,29 دجنبر 2022,11:29
اللجنة الإقليمية لليقظة لمواجهة موجة البرد تعقد اجتماعاً ببني ملال,29 دجنبر 2022,10:26
السيد بنموسى يطلع على سير الدراسة بإقليم السمارة,29 دجنبر 2022,09:45
توقعات أحوال الطقس اليوم الخميس,29 دجنبر 2022,09:22
الصويرة غاصة عن آخرها، ولا توجد غرفة متوفرة بالمدينة ونواحيها,29 دجنبر 2022,08:18
مطار الحسيمة الشريف الإدريسي يستقبل أزيد من 83 ألف مسافرٍ,28 دجنبر 2022,22:28
تفعيل الطابع الرسمي للأمازيغية محور جلسة عمل بالرباط,28 دجنبر 2022,21:33
تحديد مكان دفن عظام بشرية داخل بقايا مسكن مهجور بمنطقة,28 دجنبر 2022,20:48
انزكان : انطلاق الموسم التكويني للمتدربين من الأطر النظامية للأكاديمية,28 دجنبر 2022,20:35
مؤسسة بزاكورة تستضيف وفداً من وزارة التربية الوطنية بمدغشقر,28 دجنبر 2022,19:16
السيدة غيثة مزور تترأس لقاء تشاورياً حول مجال الرقمنة بالداخلة,28 دجنبر 2022,18:15
المحطة الطرقية الجديدة بطنجة تتجاوز عتبة مليون مسافر خلال السنة,28 دجنبر 2022,12:21
افتتاح الملتقى الجهوي للنقل الحضري بالمضيق,28 دجنبر 2022,12:02
بني ملال : إطلاق أشغال أكبر مركب سينمائي وفني متعدد,28 دجنبر 2022,11:46
مهرجان السعيدية السينمائي يختتم فعاليات دورته السابعة,28 دجنبر 2022,11:27
نشرة إنذارية : أمطار رعدية ورياح قوية بعدد من الأقاليم,28 دجنبر 2022,11:24
التساقطات المطرية الأخيرة تنعش آمال الفلاحين بإقليم سطات,28 دجنبر 2022,10:13
توقعات أحوال الطقس اليوم الأربعاء,28 دجنبر 2022,09:23
الوكالة المستقلة لتوزيع الماء والكهرباء بالقنيطرة: استثمارات بقيمة ملياران و755،71,27 دجنبر 2022,23:28
فاس : نجاح فكرة إعادة استعمال المياه العادمة المعالجة في,27 دجنبر 2022,22:47
تسليم 92 حافلة للنقل المدرسي بجهة بني ملال خنيفرة,27 دجنبر 2022,21:50
تدشين فضاء الذاكرة التاريخية للمقاومة والتحرير بإقليم جرادة,27 دجنبر 2022,20:33
استفاد حوالي 3450 شخصاً من خدمات قافلة طبية متعددة التخصصات,27 دجنبر 2022,18:39
إطلاق النسخة الثانية لقافلة ريادة الأعمال بمراكش,27 دجنبر 2022,11:08
عيد حانوكا: الصويرة، الاحتفاء بالعيد في أجواء حميمية,27 دجنبر 2022,09:41
العثور على أستاذ اختفى بتونفيت نواحي ميدلت,27 دجنبر 2022,09:34
طقس الثلاثاء بالمغرب جو بارد بعموم مناطق المملكة,27 دجنبر 2022,09:23
توقيع اتفاق تعاون وشراكة بخصوص خدمة الإبداع والثقافة والتراث الحساني,26 دجنبر 2022,19:22
أكادير تحتضن فعاليات الدورة الأولى للأسواق المتنقلة للاقتصاد الاجتماعي التضامني,26 دجنبر 2022,15:06
مركز التفتح الفني و الأدبي بطنجة يحتفل باليوم العالمي للغة,26 دجنبر 2022,14:05
مطار تطوان سانية الرمل يسجل تراجعاً في حركة الملاحة الجوية,26 دجنبر 2022,12:29
فيلم حبال المودة يفوز بالجائزة الكبرى لمهرجان أيام فاس للتواصل,26 دجنبر 2022,12:04
تنزيل برنامج غني ومتنوع لتنشيط الحياة الثقافية والفنية خلال سنة,26 دجنبر 2022,11:32
النعم ميارة يؤكد أن مأسسة الحوار الاجتماعي يشكل مكسبا كبيرا,26 دجنبر 2022,10:14
بني ملال : اجتماع حول الهدر المدرسي وبحث سبل الحد,26 دجنبر 2022,10:09
توقعات أحوال الطقس اليوم الأحد,25 دجنبر 2022,09:48
الدار البيضاء : حملة للكشف عن داء السيدا والتحسيس بخطورته,24 دجنبر 2022,23:45
الصويرة تحتضن النسخة السابعة لمهرجان الحضرة النسائية وموسيقى الحال,24 دجنبر 2022,14:58
جهة الرباط شهدت وتيرة متسارعة وتطورا ملحوظا على مستوى البنيات,24 دجنبر 2022,14:33
الدار البيضاء : السيد يونس السكوري يشرف على تسليم الشهادات,24 دجنبر 2022,12:12
السيدة نبيلة الرميلي تشرف على افتتاح المركب الثقافي الحسني بالدار,24 دجنبر 2022,11:12
أمن الدار البيضاء : إجهاض عملية للتهريب الدولي للمخدرات,24 دجنبر 2022,10:01
توقعات أحوال الطقس اليوم السبت,24 دجنبر 2022,09:23
انعقاد اجتماع مجلس إدارة المدرسة الحسنية للأشغال العمومية بالرباط,23 دجنبر 2022,19:22
رفع اللواء الأخضر بمجموعة مدارس الخدارة بالمديرية الإقليمية ببرشيد,23 دجنبر 2022,18:37
أمن طنجة يضطر لاستخدام السلاح الوظيفي لتوقيف جانح خطير,23 دجنبر 2022,17:54
مصرع أربعة عمال وإصابة آخر إثر سقوطهم في قعر حفرة,23 دجنبر 2022,16:34
السيدة غيثة مزور تترأس افتتاح اللقاء الجهوي التشاوري حول الرقمنة,23 دجنبر 2022,16:31
السيد مصطفى بايتاس يترأس حفل تسليم جائزة المجتمع المدني بالرباط,23 دجنبر 2022,15:48
السيد عبد اللطيف وهبي يدشّن المركز القضائي بتاهلة,23 دجنبر 2022,13:34
الطائفة اليهودية تحتفل بهيلولة الحاخام ربي براهام وزانا بالصويرة,23 دجنبر 2022,12:30
برنامج أوراش 2022 .. أزيد من 100 ورش و1480 مستفيدا,23 دجنبر 2022,11:22
الحسيمة .. تواصل فعاليات مهرجان رياس الدولي للموسيقى,23 دجنبر 2022,10:39
العمران إكسبو 2022: افتتاح النسخة السادسة من المعرض بالدار البيضاء,23 دجنبر 2022,09:33
عبد اللطيف معزوز يترأس أشغال المجلس الإداري لشركة التنمية الجهوية,23 دجنبر 2022,09:11
توقعات أحوال الطقس اليوم الجمعة,23 دجنبر 2022,09:06
لحاق المغرب للفروسية 2022: تنظيم الدورة الثانية من 8 إلى,22 دجنبر 2022,23:55
تفاصيل رسمية حول حريق مستودع الغاز بمدينة المحمدية,22 دجنبر 2022,22:33
زاكورة : فتح بحث قضائي لتحديد الأفعال المنسوبة لمفتش شرطة,22 دجنبر 2022,21:15
جماعة تطوان تعطي الانطلاقة الرسمية لمشروع مخطط الولوجيات الشاملة للتراث,22 دجنبر 2022,19:36
التساقطات المطرية تنعش آمال الفلاحين بجهة طنجة تطوان,22 دجنبر 2022,19:12
يوسف النصيري يحظى بحفل استقبال بفاس احتفاءاً بما قدمه رفقة,22 دجنبر 2022,18:51
الصويرة تحطم الرقم القياسي من حيث إقبال الزوار,22 دجنبر 2022,15:28
المجلس الإداري للأكاديمية الجهوية للتربية والتكوين لجهة مراكش يصادق على,22 دجنبر 2022,14:02
الصويرة تحتضن لقاء تنسيقياً حول تجميع المعطيات المتعلقة بمشروع التعليم,22 دجنبر 2022,13:10
جامعة محمد الخامس بالرباط تحتفي بمرور 65 سنة من عطائها,22 دجنبر 2022,10:10
بني ملال : السيد شكيب بنموسى يشرف على توقيع اتفاقية,22 دجنبر 2022,09:53
المغرب .. توقعات أحوال الطقس اليوم الخميس,22 دجنبر 2022,09:44
السيد شكيب بنموسى يترأس مجلس إدارة الأكاديمية الجهوية للتربية والتكوين,21 دجنبر 2022,20:01
أكادير : جامعة ابن زهر تحتضن مؤتمراً وطنيا حول سياسة,21 دجنبر 2022,18:55
بنك أفريقيا والمركز الجهوي للاستثمار بجهة الشرق ينظمان ندوة حول,21 دجنبر 2022,17:17
حصيلة الأنشطة والتظاهرات الثقافية بجهة الداخلة خلال سنة 2022,21 دجنبر 2022,16:09
ارتفاع معدل ملء السدود بجهة طنجة بعد التساقطات المطرية الأخيرة,21 دجنبر 2022,14:34
التساقطات المطرية بجهة سوس ماسة تبعث الراحة في قلوب الفلاحين,21 دجنبر 2022,12:52
مقاييس التساقطات المطرية المسجلة بالمغرب,21 دجنبر 2022,11:21
تسليم سيارات إسعاف وحافلات للنقل المدرسي للعديد من الجماعات القروية,21 دجنبر 2022,10:58
توقعات أحوال الطقس اليوم الأربعاء بالمغرب,21 دجنبر 2022,09:45
افتتاح مصحة متعددة التخصصات لتأهيل قطاع الصحة بالعيون,20 دجنبر 2022,18:14
تنصيب رئيسين جديدين لمؤسستين تابعتين لجامعة عبد المالك السعدي بطنجة,20 دجنبر 2022,15:24
توقعات أحوال الطقس اليوم الثلاثاء,20 دجنبر 2022,08:49
المجلس الأعلى للسلطة القضائية ينظم دورة تكوينية لفائدة المسؤولين القضائيين,19 دجنبر 2022,15:59
المجلس الإقليمي لكلميم يصادق على مشروع الميزانية الإقليمية لسنة 2023,19 دجنبر 2022,15:39
طاطا تحتضن معرضا إقليميا للصناعة التقليدية ابتداءاً من الجمعة المقبل,19 دجنبر 2022,13:22
التساقطات المطرية الأخيرة تبعث الراحة في نفوس الفلاحين ومربي المواشي,19 دجنبر 2022,11:25
سبل تعزيز ولوج المرأة للدينامية الاقتصادية محور لقاء وطني بمؤسسة,19 دجنبر 2022,10:22
توقعات أحوال الطقس اليوم الاثنين,19 دجنبر 2022,08:52
السيد صديقي يترأس أشغال المجلسين الإداريين للمكتبين الجهويين للاستثمار الفلاحي,18 دجنبر 2022,11:00
"هزة أرضية بقوة 3,3 درجات بعرض ساحل إقليم أكادير",18 دجنبر 2022,09:44
توقعات أحوال الطقس اليوم الأحد,18 دجنبر 2022,09:36
مقاييس الأمطار المسجلة بالمملكة خلال الـ 24 ساعة الماضية,17 دجنبر 2022,12:40
توقعات أحوال الطقس اليوم السبت,17 دجنبر 2022,09:46
أكادير : إنطلاق عملية دعم المتضررين من جائحة كوفيد بجهة,16 دجنبر 2022,20:43
اطلاق حملة إنسانية لإيواء ومساعدة المتشردين بالعرائش,16 دجنبر 2022,13:00
مقاييس التساقطات المطرية المسجلة بالمملكة المغربية,16 دجنبر 2022,12:45
مخاطر العنف الرقمي على النساء والفتيات محور ندوة بطانطان,16 دجنبر 2022,11:12
الرباط : السيدة عواطف حيار تدعو إلى خلق حضانات للأطفال,16 دجنبر 2022,09:46
توقعات أحوال الطقس اليوم الجمعة,16 دجنبر 2022,09:15
الدار البيضاء : المدرسة المغربية لعلوم المهندس تطلق فعاليات النسخة,15 دجنبر 2022,20:33
السيدة فاطمة الزهراء عمور تشرف على تدشين فندق فيرمونت مارينا,15 دجنبر 2022,15:59
الرباط : المدرسة العليا للإعلام والاتصال تحتضن أشغال منتدى شمال,15 دجنبر 2022,15:00
توقعات أحوال الطقس اليوم الخميس بالمغرب,15 دجنبر 2022,09:41
مؤسسة محمد السادس لإعادة إدماج السجناء تسلم معدات لدعم المشاريع,14 دجنبر 2022,19:57
انتخاب السيد يونس العراقي رئيسا للمجلس الجهوي للسياحة ببني ملال,14 دجنبر 2022,16:11
افتتاح معرض للمنحوتات الرومانية بمتحف القصبة لثقافات البحر الأبيض المتوسط,14 دجنبر 2022,15:13
مراكش تحتضن أشغال الدورة الحادية عشر من المؤتمر الدولي السنوي,14 دجنبر 2022,14:17
الجديدة : منصة الابتكار الريادي تستقطب شباب الإقليم الراغبين في,14 دجنبر 2022,13:17
انطلاق أشغال الدورة الأولى لحدث DATAVERSE بخريبكة,14 دجنبر 2022,11:41
نشرة إنذارية .. أمطار رعدية وتساقطات ثلجية بعدد من مناطق,14 دجنبر 2022,11:32
تدبير المناطق البحرية والساحلية محور نقاش بجامعة شعيب الدكالي بالجديدة,14 دجنبر 2022,10:06
خريبكة : توزيع مجموعة من المعدات الطبية لفائدة الأشخاص في,14 دجنبر 2022,09:52
طقس الأربعاء .. أمطار رعدية ورياح قوية بعدد من مناطق,14 دجنبر 2022,09:40
حصيلة حوادث السير داخل المناطق الحضرية خلال الأسبوع المنصرم,13 دجنبر 2022,17:35
اختتام فعاليات المعرض الفني المتنوع لقافلة مزورة بالعرائش,13 دجنبر 2022,14:56
ارتفاع نسبي في مخزون المياه بالسدود بجهة طنجة بعد التساقطات,13 دجنبر 2022,13:49
وزان تحتضن فعاليات المعرض الجهوي العاشر للكتاب,13 دجنبر 2022,11:40
نشرة إنذارية من مستوى يقظة أحمر بعدد من مناطق المملكة,13 دجنبر 2022,11:11
بركان : السيدة عواطف حيار تشرف على تدشين وإطلاق عدد,13 دجنبر 2022,11:09
السيدة فاطمة الزهراء عمور تترأس حفل افتتاح الوحدة الفندقية الجديدة,13 دجنبر 2022,10:15
وزان تحتضن فعاليات المعرض الجهوي العاشر للكتاب,13 دجنبر 2022,11:40
نشرة إنذارية من مستوى يقظة أحمر بعدد من مناطق المملكة,13 دجنبر 2022,11:11
بركان : السيدة عواطف حيار تشرف على تدشين وإطلاق عدد,13 دجنبر 2022,11:09
السيدة فاطمة الزهراء عمور تترأس حفل افتتاح الوحدة الفندقية الجديدة,13 دجنبر 2022,10:15
بني ملال : السيد عبد اللطيف ميراوي يوقع عقود مع,13 دجنبر 2022,09:55
السيد شكيب بنموسى يدشن المركز الجهوي للكفاءات العرضانية والتفتح الفني,13 دجنبر 2022,09:38
توقعات أحوال الطقس اليوم الثلاثاء بالمغرب,13 دجنبر 2022,09:30
إقبال كبير على الأسواق المتنقلة لمنتجات الاقتصاد الاجتماعي والتضامني بتازة,12 دجنبر 2022,19:53
الرباط : مولاي الحسن الداكي يؤكد أن المغرب حرص على,12 دجنبر 2022,19:05
أمن طنجة : وفاة شخص مبحوث عنه في قضايا زجرية,12 دجنبر 2022,16:12
