Ligne précédente,Date,Heure
مؤسسة محمد الخامس للتضامن تقيم وحدة طبية متنقلة لفائدة المتضررين,15 شتنبر 2023,15:11
زلزال الحوز: المصالح الصحية بأكادير تعمل جاهدة لتقديم كل أشكال,15 شتنبر 2023,13:31
تأجيل انعقاد ملتقى الأعمال المغربي الليبي بطنجة إلى نونبر المقبل,15 شتنبر 2023,11:03
توقعات أحوال الطقس اليوم الجمعة,15 شتنبر 2023,09:09
تسليم هبات ملكية للشرفاء الأدارسة بفاس وعدد من الزوايا بصفرو,14 شتنبر 2023,20:53
أمن تمارة يوقف ثلاثة أشخاص للإشتباه في استلائهم على مواد,14 شتنبر 2023,16:43
الراشيدية: توقيف شخص يشتبه في نشره محتوى يزعم فيه التوجه,14 شتنبر 2023,15:39
جماعة ثلاث نيعقوب: قافلة طبية متعددة التخصصات لإنقاذ الجرحى,14 شتنبر 2023,15:29
وزارة التجهيز والماء تنفند شائعات تضرر بعض سدود إقليم الحوز,14 شتنبر 2023,13:11
الداخلة: البحرية الملكية تقدم المساعدة لـ 98 مرشحا للهجرة غير,14 شتنبر 2023,11:06
أمن أنفا: توقيف شخص للاشتباه في تورطه في تعريض سيدة,13 شتنبر 2023,22:33
الطريق الوطنية رقم 7 بين تحناوت وتارودانت مقطوعة في وجه,13 شتنبر 2023,19:39
في أسني، الالتفاتة الملكية بلسم للقلوب,13 شتنبر 2023,19:35
المؤسسة الوطنية للمتاحف تعمل على إعادة فتح المتاحف المتضررة بمراكش,13 شتنبر 2023,19:06
جمع أزيد من 1700 كيس دم بجهة الشرق لفائدة ضحايا,13 شتنبر 2023,18:52
مهرجان فاس للموسيقى العالمية العريقة 2023: تأجيل الدورة ال 27,13 شتنبر 2023,18:50
سلطات محلية تنفي ادعاءات سقوط مروحية بتراب إقليم أزيلال,13 شتنبر 2023,16:24
فتح الطريق المؤدية إلى إيغيل بؤرة الزلزال وتيسر تدفق الإمدادات,13 شتنبر 2023,16:12
الحسيمة: توقيف 17 مرشحا للهجرة غير المشروعة,13 شتنبر 2023,14:39
المستشفى العسكري بأسني يقدم العلاجات للجرحى في مختلف التخصصات الطبية,13 شتنبر 2023,14:27
المصالح الصحية بسوس ماسة معبأة بالكامل لتلبية احتياجات المتضررين من,13 شتنبر 2023,13:47
توقعات أحوال الطقس اليوم الأربعاء,13 شتنبر 2023,09:15
إقليم تارودانت: القوات المسلحة الملكية تقيم مستشفى طبي جراحي ميداني,12 شتنبر 2023,18:25
مؤسسة محمد الخامس للتضامن تحدث مستودعا مركزيا بمراكش لتجميع المساعدات,12 شتنبر 2023,14:52
إقليم الحوز يضمد جراحه بفضل انتشار لوجستيكي كبير,12 شتنبر 2023,13:41
طقس الثلاثاء.. أجواء حارة بعموم مناطق المملكة,12 شتنبر 2023,08:33
إقليم تارودانت: مؤسسة التعاون الوطني تتعبأ من أجل تقديم المساعدة,11 شتنبر 2023,13:16
توقعات أحوال الطقس اليوم الاثنين,11 شتنبر 2023,08:49
زلزال الحوز.. تنفيذا للتعليمات الملكية السامية، عبد الوافي لفتيت يترأس,10 شتنبر 2023,19:36
قوافل محملة بمساعدات غذائية ولوجستية تغادر جهة الشمال نحو المناطق,10 شتنبر 2023,18:11
زلزال المغرب: السلطات المحلية بأزيلال تعمل جاهدة على تقديم الدعم,9 شتنبر 2023,21:42
زلزال الحوز: تعبئة كبيرة للأطقم الطبية والصحية بمراكش لإسعاف المصابين,9 شتنبر 2023,19:08
زلزال الحوز: توافد كبير على مراكز تحاقن بالدم بالدار البيضاء,9 شتنبر 2023,16:37
المندوبية الإقليمية للصحة بالرشيدية تطلق نداء للتبرع بالدم إثر الزلزال,9 شتنبر 2023,15:45
ساكنة طنجة وضواحيها تقبل بكثافة على التبرع بالدم لفائدة ضحايا,9 شتنبر 2023,14:55
تارودانت: تسخير تجهيزات طبية مهمة لمساعدة المتضررين من الزلزال,9 شتنبر 2023,14:36
زلزال الحوز.. توافد أعداد كبيرة من المواطنين على مركز تحاقن,9 شتنبر 2023,11:02
زلزال الحوز .. انطلاق عملية إيصال المساعدات للمناطق المتضررة,9 شتنبر 2023,08:42
زلزال الحوز: تعبئة كبيرة بالمركز الجهوي لتحاقن الدم بمراكش لاستقبال,9 شتنبر 2023,06:48
تعبئة قوية في تارودانت لتقديم المساعدة للمتضررين من الزلزال,9 شتنبر 2023,05:52
تعبئة عفوية لساكنة مراكش لتقديم يد المساعدة للمتضررين من الهزة,9 شتنبر 2023,04:59
المركز الجهوي لتحاقن الدم بمراكش يوجه نداء للتبرع بالدم على,9 شتنبر 2023,04:49
مؤسسة محمد السادس للعلوم والصحة والجامعة الدولية بالرباط يوقعان مذكرة,8 شتنبر 2023,17:19
المدرسة الوطنية للعلوم التطبيقية بتطوان تفتتح مسلكا جديدا في علوم,8 شتنبر 2023,15:20
الطائفة اليهودية المغربية تحتفي بهيلولة الحاخام حاييم بينتو بالصويرة,8 شتنبر 2023,13:07
الوكالة الدولية للنظام القياسي الدولي لترقيم الكتب تعقد جمعها العام,8 شتنبر 2023,12:56
المؤتمر الدولي العاشر حول المنتزهات الجيولوجية لليونسكو: افتتاح الأشغال بمراكش,7 شتنبر 2023,20:34
الدارالبيضاء: توقيف قاصرين يشتبه تورطهما في عملية سرقة موضوع شريط,7 شتنبر 2023,18:01
جامعة عبد المالك السعدي تحرك مسطرة المتابعة القانونية لاختراق منصة,6 شتنبر 2023,11:20
السكوري يعطي من جهة طنجة-تطوان-الحسيمة الانطلاقة الرسمية للسنة التكوينية الجديدة,5 شتنبر 2023,21:39
المؤتمر الدولي العاشر حول المنتزهات الجيولوجية: 195 منتزها جيولوجيا لليونسكو,5 شتنبر 2023,15:04
إكتشاف غير مسبوق لنوعين جديدين من الديناصورات بخريبكة,4 شتنبر 2023,18:17
مطار وجدة – أنجاد يوضح بخصوص اضطراب في برنامج الرحلات,4 شتنبر 2023,15:26
الموسم الدراسي 2023-2024 ينطلق بالمؤسسات التعليمية بالمملكة,4 شتنبر 2023,14:16
الدار البيضاء: توقيف سائق دراجة نارية يشتبه في ارتكابه لحادثة,4 شتنبر 2023,13:11
1.77 مليار درهم لتأهيل البنية التحتية بجهة طنجة-تطوان-الحسيمة بين 2023,4 شتنبر 2023,12:54
معبر باب سبتة: ضبط 40 كلغ من مخدر الشيرا وإحباط,4 شتنبر 2023,12:14
ضبط كمية كبيرة من مخدر بوفا وعقاقير مخدرة بمعبر باب,2 شتنبر 2023,10:11
توقعات أحوال الطقس اليوم السبت,2 شتنبر 2023,08:48
فاطمة الزهراء عمور: محطة السعيدية سيكون لها دور هام في,1 شتنبر 2023,21:00
إرتفاع عدد السياح ب 18 في المائة في الصويرة,1 شتنبر 2023,19:30
النيابة العامة بوجدة تفتح تحقيقا قضائيا حول حادث في عرض,1 شتنبر 2023,15:49
أمن البيضاء يحبط محاولة للتهريب الدولي عبر المسالك البحرية لحوالي,1 شتنبر 2023,15:28
إحباط محاولة تهريب كمية من المخدرات عبر معبر باب سبتة,1 شتنبر 2023,10:19
تازة: أزيد من 3700 طفل وشاب إستفاد من البرنامج الوطني,31 غشت 2023,13:01
مرحبا 2023: حوالي 14 ألف من مغاربة العالم غادروا عبر,31 غشت 2023,10:58
دعم متواصل لمشاريع شباب سيدي سليمان تحت اطار المبادرة الوطنية,30 غشت 2023,19:58
فاس: توقيف شخص يشتبه تورطه في ارتكاب عملية سرقة تحت,30 غشت 2023,18:36
أمن مكناس يوقف مهاجرا مغربيا موضوع أمر دولي لتورطه في,30 غشت 2023,16:20
تنصيب رجال السلطة الجدد المعينين بعمالة مقاطعة عين الشق بالدار,30 غشت 2023,15:52
منصة الشباب بسيدي قاسم: فضاء واعد للشباب حاملي المشاريع لتحقيق,29 غشت 2023,23:01
تسليم هبة ملكية لشرفاء زاوية سيدي أحمد أوموسى بتزنيت,29 غشت 2023,18:41
الصويرة تحطم جميع الأرقام من حيث عدد الزوار خلال صيف,29 غشت 2023,17:58
أمن الرباط يوقف مواطنا إفريقيا في وضعية إقامة غير قانونية,29 غشت 2023,17:33
تدفق الأمتار المكعبة الأولى من مياه نهر سبو بحوض أبي,29 غشت 2023,14:55
تسليم هبة ملكية لشرفاء زاوية سيدي أحمد أوموسى بتزنيت,29 غشت 2023,18:41
الصويرة تحطم جميع الأرقام من حيث عدد الزوار خلال صيف,29 غشت 2023,17:58
أمن الرباط يوقف مواطنا إفريقيا في وضعية إقامة غير قانونية,29 غشت 2023,17:33
تدفق الأمتار المكعبة الأولى من مياه نهر سبو بحوض أبي,29 غشت 2023,14:55
كلية العلوم والتقنيات بالحسيمة تفتتح مسالك جديدة,29 غشت 2023,14:21
شغب ديربي الشرق يسفر عن توقيف 21 شخصا,28 غشت 2023,17:15
مندوبية السجون تنفي ما تم نشره على لسان زوجة أحد,28 غشت 2023,11:14
باب سبتة: إحباط محاولة تهريب 65 كلغ من مخدر الشيرا,27 غشت 2023,21:15
شفشاون: خبراء يوصون بتخصيص دورات تكوينية للشباب في محور التنشيط,27 غشت 2023,19:10
درجات الحرارة الدنيا والعليا المرتقبة غدا الإثنين بالمملكة المغربية,27 غشت 2023,12:05
إنطلاق تشغيل مشروع التزويد بالماء الشروب عبر تحلية مياه البحر,26 غشت 2023,15:37
السياقة الإستعراضية وعدم الامتثال تؤديان إلى اعتقال شخصين بطنجة,26 غشت 2023,15:14
توقعات أحوال الطقس اليوم السبت,26 غشت 2023,09:15
باب سبتة: حجز 58 كلغ من مخدر الشيرا,25 غشت 2023,12:39
معرض جماعي مغربي أمريكي لاتيني بمتحف التصوير الفوتوغرافي بالرباط,24 غشت 2023,20:29
توقيف خمسة أشخاص بكل من طانطان والمهدية يشتبه ارتباطهم بشبكات,24 غشت 2023,18:00
تاونات: الجهود متواصلة لإخماد حريقين بالغابة المخزنية ورغة العليا وورغة,24 غشت 2023,15:21
إنزكان أيت ملول: تدشين وإطلاق مشاريع تنموية بعدد من الجماعات,23 غشت 2023,16:31
جامعة محمد السادس التقنية تطلق الدورة الصيفية لبرنامج المرأة في,22 غشت 2023,18:16
إقليم وزان: إنجاز مشاريع مهيكلة بقيمة 215 مليون درهم,22 غشت 2023,15:50
طنجة: توقيف ثلاثة أشخاص للاشتباه بتورطهم في قضية السرقة تحت,22 غشت 2023,13:33
إنزكان: تدشين وإعطاء انطلاقة مشاريع تنموية تخليدا لذكرى ثورة الملك,22 غشت 2023,13:10
البحرية الملكية تساعد 190 مرشحا للهجرة غير الشرعية,22 غشت 2023,11:52
إقليم تارودانت: تدشين وإعطاء انطلاقة عدد من المشاريع التنموية,21 غشت 2023,17:44
معبر باب سبتة: إحباط محاولة تهريب كمية من مخدر الشيرا,21 غشت 2023,16:51
جرسيف.. أنشطة متنوعة تخليدا لذكرى ثورة الملك والشعب وعيد الشباب,21 غشت 2023,14:22
تازة.. إعطاء انطلاقة أشغال بناء وتجهيز مركز الأمل للأشخاص ذوي,21 غشت 2023,14:17
عيد الشباب 2023: القوات الملكية الجوية تنظم استعراضات جوية غدا,20 غشت 2023,17:49
الداخلة: البحرية الملكية تقدم المساعدة لـ 75 مرشحا للهجرة غير,18 غشت 2023,12:26
مهرجان خطابي تخليدا للذكرى الـ70 لانتفاضة 17 غشت بتافوغالت,17 غشت 2023,20:08
تنصيب نساء ورجال السلطة الجدد بعمالة طنجة أصيلة,17 غشت 2023,15:31
تازة: السيطرة بالكامل على حريق غابة مغراوة,17 غشت 2023,09:33
أمن طنجة: توقيف شخص يشتبه في تورطه في قضية عنف,16 غشت 2023,22:39
الصويرة: إرتفاع عدد السياح بنسبة 14 في المائة خلال 2023,16 غشت 2023,19:36
عدد المقاولات المحدثة بجهة كلميم وادنون بلغ 423 مقاولة,16 غشت 2023,14:52
أمن طنجة: توقيف شاب وفتاة للاشتباه في تورطهما في قضية,15 غشت 2023,20:27
تنصيب رجال السلطة الجدد بإقليم الفحص أنجرة,15 غشت 2023,16:36
الداخلة: تدشين وإعطاء انطلاقة مشاريع تنموية بمناسبة ذكرى استرجاع إقليم,15 غشت 2023,09:25
مصطفى الكثيري: استرجاع إقليم وادي الذهب، ملحمة بطولية في مسيرة,14 غشت 2023,22:09
تازة: تطويق حريق غابة مغراوة بنسبة 65 في المائة,14 غشت 2023,15:10
التحقيق في وفاة شرطي داخل مسكنه باستعمال سلاحه الوظيفي,14 غشت 2023,09:59
توقعات أحوال الطقس اليوم الإثنين,14 غشت 2023,08:11
تازة: الجهود تتواصل لتطويق حريق غابة مغراوة,13 غشت 2023,17:24
إقليم مديونة: مصرع عاملين خلال إنجاز أشغال شبكة التطهير السائل,13 غشت 2023,17:01
اعتراض قارب في ساحل الداخلة على متنه 130 مرشحا سنغاليا,13 غشت 2023,13:27
المخيم الصيفي ال14 لفائدة الأطفال المقدسيين ينطلق بطنجة,12 غشت 2023,15:23
تحويط حريق غابة كاب سبارتيل بنسبة تناهز 85 في المائة,12 غشت 2023,07:30
البحرية الملكية تقدم المساعدة لـ 67 مرشحا للهجرة غير الشرعية,11 غشت 2023,15:55
اليوم الوطني للمهاجر: لقاء بطنجة لاستعراض العرض الجهوي وآليات دعم,10 غشت 2023,21:56
إنقاذ لوحة جدارية من التراث الفني التاريخي الخاص بمدينة تطوان,10 غشت 2023,14:29
مطار وجدة أنجاد يتعبأ في إطار عملية مرحبا 2023 لاستقبال,9 غشت 2023,20:26
كلية العلوم السملالية بمراكش تطلق مسلكا جديدا للتميز,9 غشت 2023,19:21
موسم مولاي عبد الله أمغار بالجديدة… تراث مغربي عريق يصارع,9 غشت 2023,13:52
طائرات كاندير تتدخل لإخماد حرائق في محمية غابوية بالقنيطرة,9 غشت 2023,13:08
الجديدة: تسليم هبة ملكية لمعوزين ومرضى وذوي احتياجات خاصة بمناسبة,8 غشت 2023,19:18
المدرسة الوطنية للعلوم التطبيقية بتطوان تفتح تكوينا تقنيا مستمرا يستجيب,8 غشت 2023,18:29
البحرية الملكية تقدم المساعدة لـ 56 مرشحا للهجرة غير الشرعية,8 غشت 2023,17:42
مطار الرباط سلا يستقبل أزيد من 553 ألف مسافر,8 غشت 2023,15:48
أزيد من 6 آلاف مسافر عبروا مطار طانطان,8 غشت 2023,12:16
كلية الآداب بتطوان تطلق مسالك جديدة في إطار تسريع وتحويل,8 غشت 2023,12:14
الحكم الصادر في مارس 2019 حول حادثة سير نتج عنها,8 غشت 2023,01:13
إرتفاع ليالي المبيت السياحية بالرباط بـ 49 في المائة,7 غشت 2023,18:00
أزيد من 13 ألف مسافر يعبرون مطار كلميم,7 غشت 2023,16:24
جامعة ابن زهر بأكادير تطلق جيلا جديدا من التكوينات الجامعية,7 غشت 2023,14:27
البحرية الملكية تقدم المساعدة لـ 194 مرشحا للهجرة غير الشرعية,7 غشت 2023,12:31
أكادير: توقيف مواطن برازيلي موضوع نشرة حمراء للأنتربول بمطار المسيرة,5 غشت 2023,14:53
ميناء طنجة المتوسط: ضبط كميات مهمة من المفرقعات النارية وكبسولات,4 غشت 2023,16:06
وزير الصحة يعطي بجهة طنجة تطوان الحسيمة انطلاقة خدمات 7,4 غشت 2023,14:55
مطار الشريف الإدريسي بالحسيمة يستقبل أزيد من 23 ألف من,4 غشت 2023,14:32
الدار البيضاء: إخماد حريق قبالة المحطة الطرقية اولاد زيان,4 غشت 2023,13:32
جامعة عبد المالك السعدي توفر 83 مسلكا تكوينيا جديدا في,3 غشت 2023,12:56
إدارة السجن المحلي عين السبع 1 تنفي ما تم ترويجه,3 غشت 2023,12:19
محاربة الاستغلال العشوائي لشواطئ المضيق (بلاغ),3 غشت 2023,09:09
توقعات أحوال الطقس اليوم الخميس,3 غشت 2023,08:03
اتحاد طنجة لكرة القدم يعلن عن انتدابات جديدة استعدادا للموسم,1 غشت 2023,09:37
المركز الوطني محمد السادس للمعاقين وملحقاته الجهوية يتعبؤون لتسهيل الإدماج,31 يوليوز 2023,20:10
الدار البيضاء: توقيف المشتبه فيه الرئيسي في قضية صدم شخص,31 يوليوز 2023,18:11
إقليم تزنيت: إعطاء الإنطلاقة لعدد من المشاريع التنموية بمناسبة عيد,31 يوليوز 2023,14:30
إحتفالات بهيجة بتطوان تحت أنوار المشاعل والشهب النارية بمناسبة عيد,31 يوليوز 2023,12:06
مصرع طفلة وإصابة 19 شخصا في حادثة سير بإقليم بولمان,30 يوليوز 2023,21:58
المكتبة الوسائطية الكبرى بمدينة العيون .. افتتاح ثاني أكبر مكتبة,30 يوليوز 2023,13:46
توقعات أحوال الطقس اليوم الأحد بالمملكة المغربية,30 يوليوز 2023,08:00
تدشين عدد من المشاريع البنيوية بإقليم بنسليمان,29 يوليوز 2023,20:33
عمالة مراكش.. تدشين وإعطاء انطلاقة عدد من المشاريع التنموية بمناسبة,29 يوليوز 2023,19:09
السمارة: تدشين وإعطاء الانطلاقة لعدد من المشاريع التنموية بمناسبة عيد,29 يوليوز 2023,17:43
سطات: تدشين وإعطاء انطلاقة عدة مشاريع تنموية بمناسبة عيد العرش,29 يوليوز 2023,15:40
كلميم وادنون: توقيع اتفاقية شراكة لتأهيل البنيات التحتية الطرقية بالجهة,29 يوليوز 2023,13:38
عيد العرش 2023: استمرار زخم التنمية ببني ملال,29 يوليوز 2023,10:50
أوسرد: حوالي 400 مستفيد من قافلة طبية مغربية أمريكية متعددة,29 يوليوز 2023,10:37
الصويرة: توقيع اتفاقية من أجل عصرنة وتسويق المنتجات الفلاحية ومنتجات,28 يوليوز 2023,22:23
إقليم الرشيدية: المكتب الوطني للكهرباء والماء يوضح بشأن تسيير خدمة,28 يوليوز 2023,20:26
عيد العرش المجيد 2023: القوات الملكية الجوية تنظم استعراضات جوية,28 يوليوز 2023,19:04
الطائفة اليهودية المغربية بجهة مراكش آسفي تحتفل بعيد العرش المجيد,28 يوليوز 2023,15:54
العروض الفنية لنوستالجيا عاطفة الأمس بشالة عرفت حضور حوالي 20,28 يوليوز 2023,14:09
تدشين وإعطاء انطلاقة عدة مشاريع تنموية بإقليم الرحامنة بمناسبة عيد,28 يوليوز 2023,10:50
سطات : مصرع قاصر وإصابة آخر بجروح بليغة في حادث,28 يوليوز 2023,10:00
بني ملال : تدشين وإطلاق مشاريع تنموية بمناسبة عيد العرش,28 يوليوز 2023,02:05
إقليم بولمان.. إطلاق عدد من المشاريع التنموية بمناسبة عيد العرش,28 يوليوز 2023,01:57
عيد العرش 2023: تدشين وإعطاء انطلاقة عدة مشاريع تنموية بإقليم,28 يوليوز 2023,01:39
اللواء الأزرق يرفرف بشاطئ بوزنيقة للسنة ال17 على التوالي,27 يوليوز 2023,18:44
تاونات: هبة ملكية للشرفاء الصافيين ولأشخاص معوزين ومن ذوي الاحتياجات,27 يوليوز 2023,14:05
الدار البيضاء: حجز 1.1 كلغ من الكوكايين وتوقيف شخصين يشتبه,27 يوليوز 2023,10:20
توقعات أحوال الطقس اليوم الخميس,27 يوليوز 2023,08:57
بمناسبة عيد العرش .. إعطاء انطلاقة أشغال إنجاز عدد من,26 يوليوز 2023,22:03
شرطي بالعيون يضطر لاستعمال سلاحه الوظيفي خلال تدخل لتوقيف ثلاثة,26 يوليوز 2023,21:48
توقيف خمسة أشخاص بالقينطرة يشتبه تورطهم في ترويج المخدرات والمؤثرات,26 يوليوز 2023,19:15
حجز أزيد من 19 ألف وحدة من المفرقعات النارية وتوقيف,26 يوليوز 2023,11:37
مطار تطوان سانية الرمل يسجل أعلى معدل استرجاع لحركة الملاحة,26 يوليوز 2023,11:29
برنامج التنمية الحضرية لأكادير 2020-2024: مشاريع تعزز الجاذبية السياحية للمدينة,26 يوليوز 2023,11:08
إدارة السجن المحلي رأس الماء فاس تنفي مضامين فيديو منشور,25 يوليوز 2023,21:27
السيد بركة: نسبة إنجاز مشروع الربط المائي بين حوضي سبو,25 يوليوز 2023,18:52
أكاديمية الحسن الثاني للعلوم والتقنيات: تسليم منح التميز للفائزين في,25 يوليوز 2023,18:15
التدشين الرسمي لمركز ترحيل الخدمات التابع للشركة العملاقة HCL Tech,25 يوليوز 2023,17:40
حملة بحر بلا بلاستيك تحط الرحال بشاطئ الدالية,25 يوليوز 2023,16:44
مفتش شرطة بفاس يضطر لاستخدام سلاحه الوظيفي لتحييد الخطر الصادر,25 يوليوز 2023,12:21
أمن البيضاء يوقف ثلاثة أشخاص ظهروا في شريط فيديو وهم,25 يوليوز 2023,11:55
مطار طنجة ابن بطوطة: توقيف مواطن بريطاني يشتبه تورطه في,25 يوليوز 2023,11:36
وزير الصناعة يشرف بسلا على وضع الحجر الأساس للمصنع الجديد,24 يوليوز 2023,19:46
بوجدور: توقيف شخص يشتبه تورطه في حيازة وترويج الشهب النارية,24 يوليوز 2023,15:19
توقيف شخصين في العيون للاشتباه بتورطهما في التغرير بقاصر والاحتجاز,24 يوليوز 2023,15:16
الدار البيضاء: توقيف شخصين يشتبه تورطهما في قضية تتعلق بحيازة,24 يوليوز 2023,14:37
أولاد تايمة: توقيف شخص للاشتباه بتورطه في حيازة وترويج الشهب,24 يوليوز 2023,13:44
أمن المحمدية يوقف شخصا للإشتباه في تورطه في حيازة وترويج,24 يوليوز 2023,13:26
عملية مرحبا 2023: ميناء الحسيمة يستقبل أزيد من 17 ألف,24 يوليوز 2023,13:09
وزير الفلاحة يعطي بخنيفرة إنطلاقة سلسلة من المشاريع التنموية في,22 يوليوز 2023,19:00
فعاليات نوستالجيا عاطفة الأمس تنطلق في شالة بالرباط,22 يوليوز 2023,16:34
