Ligne précédente,Date,Heure
الجامعة الأورومتوسطية بفاس تطلق دبلوما في تقييم التكنولوجيات الصحية,26 أبريل 2024,15:07
طنجة: إغلاق السجن المحلي سات فيلاج بصفة نهائية,26 أبريل 2024,14:49
مطار تطوان يستقبل أكثر من 39 ألف مسافر خلال الفصل,26 أبريل 2024,13:17
أكادير: مهرجان سوس كاسترو الدولي لفنون الطهي ونجوم المطبخ ينطلق,26 أبريل 2024,12:55
الداخلة: دبلوماسيون أفارقة يستكشفون إمكانات الجهة,25 أبريل 2024,18:37
الداخلة: البحرية الملكية تقدم المساعدة لـ 85 مرشحا للهجرة غير,25 أبريل 2024,16:47
مطار الناظور العروي يستقبل أزيد من 188 ألف مسافر خلال,25 أبريل 2024,13:26
مهرجان جدار فن الشارع: رسم 12 جدارية جديدة بمختلف أحياء,25 أبريل 2024,12:00
وفد بلجيكي يزور طنجة لتبادل الخبرات في مجالي البنيات التحتية,24 أبريل 2024,19:39
الداخلة: افتتاح أشغال المنتدى الدولي الأول حول الصحراء المغربية,24 أبريل 2024,18:38
مطار محمد الخامس الدولي بالدار البيضاء يعرف زيادة في حركة,24 أبريل 2024,15:07
طنجة: توقيف شخص يشتبه تورطه في قضية تتعلق بالمس بنظم,24 أبريل 2024,11:43
تنغير: تخليد الذكرى الـ 91 لمعركة بوغافر المجيدة,24 أبريل 2024,10:59
فاس: توقيف شخص للاشتباه في تورطه في القتل العمد وإضرام,22 أبريل 2024,18:34
الداخلة: القوات المسلحة الملكية تقدم المساعدة لـ 52 مرشحا للهجرة,22 أبريل 2024,10:59
جماعة طنجة تحصل على منحة استحقاق من وزارة الداخلية بقيمة,20 أبريل 2024,18:25
إدارة السجن المحلي علي مومن بسطات: تم إبلاغ النيابة العامة,20 أبريل 2024,17:50
مهرجان تطوان لسينما البحر الأبيض المتوسط: 12 فيلما يتنافسون على,20 أبريل 2024,15:49
وجدة: خفض صبيب الماء الشروب من 22 إلى 29 أبريل,20 أبريل 2024,15:14
تازة: موظف شرطة يضطر لاستعمال سلاحه الوظيفي لتوقيف جانح عرض,20 أبريل 2024,13:38
الصويرة: إعطاء انطلاقة مشروع للتكوين المستمر لفائدة الحرفيين المغاربة في,19 أبريل 2024,18:35
أمن طنجة يوقف ثلاثة أشخاص يشتبه في ارتباطهم بالاتجار غير,19 أبريل 2024,17:52
السجن المحلي الجديدة 2: ادعاءات سجين سابق بتجويع السجناء لا,19 أبريل 2024,15:38
مهرجان مراكش كناوة شو ينظم دورته السابعة في ماي المقبل,19 أبريل 2024,14:59
القوات الملكية الجوية بجهة العيون تقدم المساعدة ل12 مرشحا للهجرة,18 أبريل 2024,21:02
أصيلة: توقيف ثلاثة أشخاص يشتبه ارتباطهم بالاتجار غير المشروع في,18 أبريل 2024,13:13
فاس: توقيف خمسة أشخاص يشتبه تورطهم في النصب والاحتيال على,18 أبريل 2024,12:05
صفرو .. افتتاح فعاليات الدورة السادسة عشرة لملتقى التوجيه المدرسي,17 أبريل 2024,21:55
الناظور: إحباط محاولة تهريب 116 ألفا و605 أقراص مهلوسة إلى,17 أبريل 2024,20:53
أمن مراكش يوقف ثلاثة أجانب موضوع أوامر دولية بإلقاء القبض,17 أبريل 2024,19:30
العيون: البحرية الملكية تقدم المساعدة لـ131 مرشحا للهجرة غير النظامية,17 أبريل 2024,18:15
السجن المحلي بطانطان: الشكاية الكيدية لأحد السجناء محاولة للضغط من,17 أبريل 2024,16:30
الرباط: تنظيم ندوة افتتاحية لأسبوع اللغة الإسبانية الثامن بالمغرب,17 أبريل 2024,13:39
أمن صفرو يوقف ثلاثة أشخاص يشتبه تورطهم في قضية تبادل,17 أبريل 2024,11:24
بركان: توقيف شخصين، أحدهما لبناني، للاشتباه في تورطهما في قضية,17 أبريل 2024,11:20
توقيع اتفاقية شراكة لدعم التربية والتكوين عن طريق الرياضة بجهة,17 أبريل 2024,10:58
الخطاط ينجا يدعو المستثمرين الإسبان الى اغتنام الفرص التي تتيحها,16 أبريل 2024,21:42
أمن البيضاء يفكك عصابة إجرامية مكونة من أربعة أشخاص يشتبه,16 أبريل 2024,15:34
جامعة سيدي محمد بن عبد الله بفاس تستضيف الندوة الدولية,16 أبريل 2024,12:50
طانطان .. البحرية الملكية تقدم المساعدة لـ53 مرشحا للهجرة غير,15 أبريل 2024,21:54
الخميسات: ضابط شرطة يضطر لاستعمال سلاحه في تدخل أمني لتوقيف,15 أبريل 2024,20:51
توقيف 4 أشخاص للاشتباه في تورطهم في التخدير والسكر العلني,15 أبريل 2024,20:00
نسبة ملء سدود حوض سبو تفوق 51 في المائة,15 أبريل 2024,14:26
مكناس: توقيف شخص في حالة تلبس بمحاولة السرقة بالكسر من,14 أبريل 2024,17:55
البحرية الملكية تقدم المساعدة لـ118 مرشحا للهجرة غير النظامية من,14 أبريل 2024,15:24
توقيف 3 أشخاص في القنيطرة بتهمة الإجهاض غير القانوني وترويج,13 أبريل 2024,22:03
توقيف شخصين بسيدي قاسم وسلا للاشتباه في تورطهما في حيازة,13 أبريل 2024,15:45
مكناس: تحرير وإنقاذ شخصين كانا ضحية لعملية اختطاف واحتجاز مقرونة,13 أبريل 2024,15:35
الملتقى الدولي الجامعة – مقاولة في دورته الثالثة من 18,13 أبريل 2024,14:56
جهة كلميم وادنون تستقبل أزيد من 46 ألف سائح خلال,13 أبريل 2024,11:30
المؤتمر الدولي ال20 للطب النفسي الديناميكي من 16 إلى 20,13 أبريل 2024,11:09
بني نصار: إجهاض عملية للتهريب الدولي للمخدرات وحجز 1431 قرصا,11 أبريل 2024,14:33
دار الولادة نزالت لعظم.. اهتمام خاص للمبادرة الوطنية للتنمية البشرية,11 أبريل 2024,10:34
إحباط محاولة للهجرة غير المشروعة صوب مدينة سبتة,10 أبريل 2024,11:00
جمارك ميناء طنجة المتوسط تعتمد تنظيما جديدا للعمل على مدار,9 أبريل 2024,13:18
توقيع اتفاقية لإحداث مناطق صناعية بجهة كلميم-واد نون,8 أبريل 2024,19:33
المبادرة الوطنية التنمية البشرية.. عناية خاصة بصحة الأم والطفل بإقليم,8 أبريل 2024,17:55
هبات ملكية لفائدة أسر معوزة بصفرو,7 أبريل 2024,16:56
الدار البيضاء: إحياء ليلة القدر المباركة في أجواء من الخشوع,7 أبريل 2024,11:11
العيون – الساقية الحمراء.. ارتباط وطيد بعادات الطبخ المتوارثة عن,6 أبريل 2024,19:41
الناظور: توقيف 16 شخصا ينشطون ضمن شبكة إجرامية متورطة في,6 أبريل 2024,14:37
المدينة القديمة بالدار البيضاء.. معلمة سياحية متميزة تعكس موروثا تاريخيا,6 أبريل 2024,10:30
بنجرير: UM6P Ventures يطلق دعوة لتقديم الطلبات من الشركات الناشئة,4 أبريل 2024,16:54
إحداث أزيد من 330 مقاولة خلال يناير 2024 بجهة العيون,3 أبريل 2024,21:50
أمن جرسيف يوقف مواطنا هولنديا من أصول مصرية موضوع أمر,3 أبريل 2024,13:24
الدار البيضاء: فتح بحث قضائي لتحديد الأفعال المنسوبة لسيدة يشتبه,3 أبريل 2024,13:15
إقليم الحوز: تواصل عملية إعادة البناء ما بعد الزلزال بعزيمة,2 أبريل 2024,22:33
تمدرس الأطفال في وضعية إعاقة محور يوم دراسي بالداخلة,2 أبريل 2024,20:04
توقيف خمسة أشخاص بكل من أكادير والرباط يشتبه في ارتباطهم,2 أبريل 2024,15:23
جهة طنجة-تطوان-الحسيمة: المخزون المائي بالسدود يتجاوز مليار متر مكعب,2 أبريل 2024,12:05
التساقطات المطرية الأخيرة تنعش آمال منتجي النباتات السكرية بحوض اللوكوس,1 أبريل 2024,22:11
مراكش.. توقيف شخص للاشتباه في ارتكابه لجريمة المس بنظم المعالجة,1 أبريل 2024,22:06
طاطا.. تنظيم نهائيات المسابقة الإقليمية الرمضانية في حفظ وتجويد القرآن,1 أبريل 2024,20:39
"الشركة الوطنية للنقل والوسائل اللوجيستيكية تحقق نتيجة صافية بقيمة 89,6",1 أبريل 2024,14:29
مراكش: تنظيم ماراثون خيري للتحسيس بأهمية التبرع بالدم,1 أبريل 2024,13:49
مكناس: إطلاق عملية واسعة لترميم الأسوار التاريخية,1 أبريل 2024,13:32
جهة طنجة-تطوان-الحسيمة: معدل ملء السدود الكبرى يتجاوز 50 في المائة,30 مارس 2024,12:14
ليلة القرآن بالرباط تحتفي بتفرد الصيغ المغربية في تلاوة الذكر,30 مارس 2024,11:46
طنجة تعزز التزامها بتوفير بيئة ميسرة للولوج لفائدة الأشخاص في,30 مارس 2024,11:20
شيشاوة: مؤسسة محمد الخامس للتضامن تنظم حملة واسعة لجراحة المياه,29 مارس 2024,21:51
إعطاء انطلاقة إنجاز مشروع تصميم التهيئة والحفاظ على المدينة العتيقة,29 مارس 2024,11:29
مركز طمر وتثمين النفايات المنزلية بتاوريرت.. مشروع واعد للمحافظة على,29 مارس 2024,10:42
أمسيات في فن المديح والسماع بالحسيمة إحياء لليالي رمضان,28 مارس 2024,23:05
اللجنة الإقليمية للتنمية البشرية بعمالة المضيق-الفنيدق تصادق على 24 مشروعا,28 مارس 2024,22:08
طنجة: تنظيم قافلة للتوعية والتحسيس باضطراب طيف التوحد,28 مارس 2024,12:52
تكنوبارك طنجة يستضيف مبادرة جيتكس إفريقيا-المغرب 200 Gitex Africa Morocco,27 مارس 2024,23:26
توزيع أكثر من 630 ألف قنطار من الشعير المدعم بجهة,27 مارس 2024,20:33
معبر باب سبتة: حجز أزيد من 72 كلغ من مخدر,27 مارس 2024,18:58
ميناء طنجة المتوسط ضمن أفضل 20 ميناء للحاويات في العالم,27 مارس 2024,15:20
الدار البيضاء: احباط عملية كبرى للتهريب الدولي للمخدرات وحجز 10,27 مارس 2024,13:59
توقعات أحوال الطقس اليوم الأربعاء,27 مارس 2024,09:33
مراكش: توقيف ثلاثة أشخاص يشتبه في ارتباطهم بشبكة إجرامية تنشط,27 مارس 2024,09:31
الرشيدية: توقيف ثلاثة أشخاص يشتبه في قرصنتهم بطاقات الأداء البنكي,26 مارس 2024,15:49
الأسواق النموذجية بالعيون.. إقبال كبير للساكنة خلال شهر رمضان المبارك,25 مارس 2024,22:00
معبر باب سبتة: حجز بضائع فاخرة مهربة بقيمة تناهز مليون,25 مارس 2024,18:23
توقيف ثلاثة أشخاص للاشتباه في تورطهم في الاختطاف والاحتجاز وتنظيم,25 مارس 2024,15:42
فتيحة المودني تنتخب عمدة لمدينة الرباط,25 مارس 2024,14:45
مصالح الأمن بمدينة الدار البيضاء تحقق في واقعة (السرقة على,25 مارس 2024,12:24
إقليم شيشاوة: تتبع صارم ومنتظم لمختلف أوراش إعادة البناء ما,24 مارس 2024,20:35
الساحات العمومية بالعيون، ملاذ الباحثين عن الاستجمام والترويح عن النفس,24 مارس 2024,14:40
الداخلة: توقيف 165 مرشحا للهجرة غير الشرعية,23 مارس 2024,14:25
رصد أزيد من 664 مليون درهم لتغطية 67 جماعة بجهة,23 مارس 2024,13:10
فن الطبخ المراكشي مكون أساسي في إشعاع المدينة الحمراء وطنيا,23 مارس 2024,12:41
ساحة الهديم بمكناس، حمولة تاريخية وحضارية متفردة,23 مارس 2024,10:18
معبر باب سبتة: حجز أزيد من 48 كلغ من مخدر,22 مارس 2024,21:49
جماعة أمزميز: مؤسسة محمد الخامس للتضامن تواصل انخراطها الطبي الفاعل,22 مارس 2024,17:12
الدار البيضاء: فطور متعدد الثقافات والأديان يحتفي بالذكرى 14 لتأسيسه,22 مارس 2024,15:20
توقيف أربعة أشخاص بكل من أكادير وطنجة يشتبه في تورطهم,21 مارس 2024,16:30
فاطمة الزهراء عمور: تثمين المنتزه الوطني لإفران من شأنه تعزيز,21 مارس 2024,14:12
حوض ملوية: تعبئة مكثفة لشرطة المياه لحماية الثروة المائية,21 مارس 2024,11:34
مراكش تحتضن المنتدى الدولي الثالث للأشجار ما بين 12 و15,20 مارس 2024,20:29
السجن المحلي العرجات 1: السجين (م.ز) يستفيد من كافة الحقوق,20 مارس 2024,14:05
ميناء طنجة: انخفاض حجم مفرغات الصيد البحري بنسبة 20 %,20 مارس 2024,13:59
مطار تطوان يشهد تراجعا في حركة النقل الجوي بنحو 11,20 مارس 2024,13:39
جهة طنجة تطوان الحسيمة: التساقطات الأخيرة لها وقع إيجابي على,20 مارس 2024,12:51
اليوم الدولي لموسيقى الجاز 2024: طنجة أول مدينة إفريقية تستضيف,20 مارس 2024,11:45
استفادة حوالي مائة مقاولة سياحية بفاس من لقاء تواصلي حول,19 مارس 2024,21:40
اليونسكو تختار طنجة مدينة مضيفة عالمية لليوم الدولي لموسيقى الجاز,19 مارس 2024,16:28
مطار طنجة ابن بطوطة: ارتفاع حركة النقل الجوي بنحو 12,19 مارس 2024,12:55
العيون: عناصر من القوات المسلحة الملكية تقدم المساعدة لـ55 مرشحا,19 مارس 2024,12:25
إدارة سجن تامسنا توضح بشأن المياه المتدفقة من محطة معالجة,19 مارس 2024,12:13
مدفع رمضان، من التقاليد العريقة الراسخة بالجديدة,19 مارس 2024,11:17
جهة فاس مكناس: 20 مسجدا تفتح أبوابها في وجه المصلين,18 مارس 2024,16:47
إطلاق حملة صاحب السمو الشيخ محمد بن زايد آل نهيان,18 مارس 2024,15:37
باب سبتة: إحباط محاولة تهريب كمية من المخدرات,18 مارس 2024,13:59
أمن مطار الدار البيضاء يوقف مواطنا ألمانيا يشكل موضوع أمر,17 مارس 2024,18:29
تطوان: توقيف شخصين للاشتباه في تورطهما في قضية تتعلق بالسرقة,17 مارس 2024,15:05
القنيطرة: ضبط 15 شخصا للاشتباه في تورطهم في ارتكاب أعمال,17 مارس 2024,14:00
أكادير: إحباط محاولة للتهريب الدولي لشحنة كبيرة من مخدر الشيرا,17 مارس 2024,12:38
أكادير: توقيف شخصين يشتبه في ارتباطهما بشبكة إجرامية تنشط في,16 مارس 2024,21:33
إقليم السمارة.. تكثيف عمليات مراقبة الأسعار وجودة المنتجات الغذائية,16 مارس 2024,17:51
أكاديمية التربية لجهة الشمال تحصد 19 ميدالية خلال البطولة المدرسية,16 مارس 2024,17:02
زهرية مراكش 2024.. موسم تقطير ماء الزهر ينطلق في دورته,16 مارس 2024,16:35
مسجد الكتبية بمراكش يعيد فتح أبوابه في وجه المصلين بعد,16 مارس 2024,16:21
ميناء طنجة المتوسط: إحباط محاولة تهريب أزيد من طن من,16 مارس 2024,11:50
اعتراض 269 مرشحا للهجرة غير الشرعية كانوا يعتزمون التوجه إلى,16 مارس 2024,10:41
جهة الدار البيضاء-سطات: استفادة أزيد من 79 ألف أسرة من,15 مارس 2024,17:30
طرفاية: مصرع ثلاثة مرشحين للهجرة غير النظامية غرقا,15 مارس 2024,14:47
إقليم العيون: استفادة أزيد من 12 ألفا و600 أسرة من,15 مارس 2024,13:56
السجن المحلي بورزازات: مندوبية السجون تتخذ إجراءات إدارية ضد موظفين,15 مارس 2024,12:50
طرفاية: البحرية الملكية تقدم المساعدة لـ 52 مرشحا للهجرة غير,15 مارس 2024,11:07
توقعات أحوال الطقس اليوم الجمعة,15 مارس 2024,09:22
المركز الثقافي بني مكادة – طنجة: انطلاق برمجة الأفلام بالقاعة,14 مارس 2024,23:59
العيون: البحرية الملكية تقدم المساعدة لـ 58 مرشحا للهجرة غير,14 مارس 2024,14:45
إنطلاق تظاهرة رمضانيات طنجة الكبرى 2024,14 مارس 2024,12:45
إحباط محاولة تهريب طن و420 كيلوغراما من مخدر الشيرا بالدارالبيضاء,13 مارس 2024,21:55
حقينة السدود بجهة سوس ماسة تجاوزت 100 مليون متر مكعب,13 مارس 2024,13:10
المركز الجهوي للإستثمار ينظم يوما تواصليا بالحسيمة لفائدة النساء المقاولات,13 مارس 2024,13:00
مراكش.. حملات مكثفة لمراقبة الأسعار والجودة بمناسبة شهر رمضان,12 مارس 2024,20:05
إطلاق طلب إبداء الاهتمام لتهيئة وتثمين المنتزه الوطني لإفران,12 مارس 2024,15:14
البطولة الوطنية المدرسية للفنون الدفاعية والإبداعية: أكادير تستضيف الحدث,12 مارس 2024,13:55
بطولة الدار البيضاء المفتوحة للشطرنج 2024: تتويج المغربية رؤى لعميم,12 مارس 2024,12:27
أزيلال: إعطاء انطلاقة أشغال بناء المستشفى الإقليمي الجديد,11 مارس 2024,22:52
صندوق التجهيز الجماعي وجهة درعة – تافيلالت يوقعان اتفاقية تمويل,11 مارس 2024,21:18
البطولة الجهوية للدراجات بالعيون: فوز الدراجين عبد الفتاح الباز وصفاء,11 مارس 2024,18:20
الدار البيضاء: اختتام فعاليات جائزة محمد الجم للمسرح في دورته,11 مارس 2024,14:42
السجن المحلي عين السبع 1: إختتام الأيام الثقافية والرياضية المنظمة,9 مارس 2024,17:52
جهة طنجة – تطوان – الحسيمة: وزير الصحة يعطي بأصيلة,9 مارس 2024,16:40
اليوم العالمي للمرأة : المركز الجهوي للاستثمار يحتفي بنسائه الموظفات,8 مارس 2024,23:55
طنجة: توقيف شخصين للاشتباه في تورطهما في حيازة وترويج أزيد,8 مارس 2024,16:01
الداخلة: القوات المسلحة الملكية تقدم المساعدة لـ 47 مرشحا للهجرة,8 مارس 2024,13:29
رفع اللواء الأخضر الدولي للبيئة بمدرسة ابن زهر الابتدائية بالسمارة,7 مارس 2024,23:49
أمن البيضاء يوقف مشتبها فيه في قضية تتعلق بعدم الامتثال,7 مارس 2024,14:57
الصويرة: الدورة الخامسة من مهرجان موغا 2024 من 2 إلى,7 مارس 2024,10:23
المعرض الإقليمي للصناعة التقليدية بخنيفرة واجهة لإبراز الدينامية الاقتصادية المحلية,6 مارس 2024,21:53
مؤسسة محمد الخامس للتضامن.. إعداد منصة للسكن بدوار تولكين بإقليم,6 مارس 2024,21:26
إطلاق جائزة التميز للبحث العلمي في مجال حقوق الإنسان,6 مارس 2024,19:58
الرباط : إعطاء انطلاقة دراسة تطوير البنيات التحتية لمطار الدار,6 مارس 2024,14:23
الداخلة: البحرية الملكية تقدم المساعدة لـ 27 مرشحا للهجرة غير,6 مارس 2024,11:05
أمن الجديدة يوقف شقيقين يشتبه ارتباطهما بشبكة إجرامية تنشط في,6 مارس 2024,11:02
الرباط: عناصر الأمن يضطرون لاستخدام أسلحتهم الوظيفية لتوقيف جانح,6 مارس 2024,10:54
المنطقة الجديدة للتسريع الصناعي لتوطين المقاولات ستمكن من إحداث 10,5 مارس 2024,22:33
توقف مؤقت لحركة السير بين بدالي المحمدية-وسط والمحمدية-غرب,5 مارس 2024,15:49
وكالة الحوض المائي اللكوس: المصادقة على ميزانية وبرنامج عمل سنة,5 مارس 2024,15:46
مجلس جهة طنجة-تطوان-الحسيمة يحصل على شهادة الجودة إيزو 9001,5 مارس 2024,15:11
السيدة عواطف حيار تتفقد المنجزات الكبرى في مجال الحماية الاجتماعية,4 مارس 2024,21:52
طنجة: ندوة علمية حول دور الإعلام في تعزيز التمكين المجتمعي,4 مارس 2024,19:00
شفشاون: حملة طبية متعددة الاختصاصات لفائدة ساكنة جماعة باب برد,3 مارس 2024,21:22
إفران: تنظيم ندوة دولية حول تقييم التربة والمياه,2 مارس 2024,19:23
طنجة: إطلاق مشروع إمكانات الهجرة وإعادة الإدماج السوسيو-اقتصادي,2 مارس 2024,17:47
أكادير: الوقاية المدنية تخلد يومها العالمي,2 مارس 2024,17:35
الشركة الوطنية للطرق السيارة توصي مستعملي الطريق السيار تازة-وجدة بتوخي,2 مارس 2024,15:14
المعرض الدولي للخشب يفتتح فعاليات دورته الخامسة بمكناس,2 مارس 2024,12:32
السيدة حيار تقوم بزيارة لعدد من المشاريع الاجتماعية الدامجة بالصويرة,2 مارس 2024,10:46
الدارالبيضاء: انطلاق الخدمة الفعلية للخطين الأول والثاني للباصواي,1 مارس 2024,16:40
جهة طنجة-تطوان-الحسيمة: وحدات القيادة الجهوية للوقاية المدنية نفذت أكثر من,1 مارس 2024,15:02
تنظيم حملة طبية جراحية للمياه الزرقاء لفائدة ساكنة الدواوير التابعة,1 مارس 2024,13:42
الداخلة: ندوة تناقش الأفق الجيوسياسي لقضية الصحراء المغربية,29 فبراير 2024,19:37
ماراثون أقرأ ينطلق في دورته الثالثة بالرباط,29 فبراير 2024,13:17
جهة فاس مكناس: انطلاق العمل بالرادار المثبت على متن المركبات,29 فبراير 2024,12:07
أسماء اغلالو تستقيل من رئاسة جماعة الرباط,29 فبراير 2024,10:57
سلا: توقيف شخص موالي لداعش للاشتباه في تورطه في التحضير,29 فبراير 2024,10:33
الجمعية المغربية لتنظيم الأسرة تفتتح بطنجة مركز خدمات لفائدة المهاجرين,28 فبراير 2024,22:30
إفران: تعبئة لإعادة فتح المحاور المقطوعة في وجه حركة السير,28 فبراير 2024,19:16
الجامعة الأورومتوسطية بفاس تنظم النسخة الثانية من تظاهرة اليوم المتوسطي,28 فبراير 2024,18:17
الداخلة: تنظيم الندوة السياسية الأولى للتحالف من أجل الحكم الذاتي,28 فبراير 2024,15:58
إقليم الناظور: مصرع ثمانية أشخاص غرقا بمياه المتوسط أثناء محاولة,28 فبراير 2024,12:03
