Ligne précédente,Date,Heure
نشرة إنذارية : زخات رعدية قوية بعدد من مناطق المملكة,24 غشت 2022,12:01
المغرب .. توقعات أحوال الطقس اليوم الأربعاء,24 غشت 2022,09:38
مهرجان طنجة الكبرى الدولي لحظة ثقافية لإبراز الإرث التاريخي وربط,23 غشت 2022,23:20
الشروع في الاستغلال التدريجي لمشروع تقوية تزويد فاس ومكناس بالماء,23 غشت 2022,22:06
ندوة دولية حول موضوع تثمين القرار الإسباني المتعلق بمبادرة الحكم,23 غشت 2022,17:39
المصادقة على سلسلة من المشاريع بتزنيت,23 غشت 2022,15:30
تاونات: حملات لإنماء الحس المقاولاتي لدى الشباب,23 غشت 2022,13:45
مطار الصويرة موكادور .. أزيد من 43 ألف مسافر متم,23 غشت 2022,13:04
توقعات أحوال الطقس بالمغرب,23 غشت 2022,09:42
حريق غابة جبل مليتر : طائرات كنادير تشارك في عمليات,22 غشت 2022,22:22
توقيع بروتوكول تعاون بين جماعتي طنجة و سانت جوس البلجيكية,22 غشت 2022,21:16
طنجة : اطلاق حملة تحسيسية للتوعية بالمحافظة على الماء وترشيد,22 غشت 2022,17:19
ميدلت والريش .. انقطاع مؤقت لحركة السير بعد غد الأربعاء,22 غشت 2022,15:14
بني ملال : الأمن يحقق في إضرام شخص النار عمداً,22 غشت 2022,13:22
مطار طنجة الدولي يستقبل أزيد من 179 ألف مسافرٍ خلال,22 غشت 2022,12:59
انطلاق العمل بالمقر الجديد للمنطقة الإقليمية للأمن بتاونات,22 غشت 2022,12:35
المغرب .. توقعات أحوال الطقس اليوم الإثنين,22 غشت 2022,09:45
توقعات أحوال الطقس اليوم الأحد بالمغرب,21 غشت 2022,10:14
أطفال مقدسيون يعتلون “جبل العلم” بالعرائش,21 غشت 2022,09:22
إقليم الحسيمة .. الجهود مستمرة للسيطرة على الحريق,20 غشت 2022,17:44
فاجعة خريبكة .. متطوعون يتبرعون بالدم لفائدة الجرحى والمصابين,20 غشت 2022,17:12
تخليد الذكرى الـ67 لمظاهرات خريبكة والمدن والقبائل المجاورة ضد الوجود,20 غشت 2022,16:11
الوكالة المستقلة لتوزيع الماء والكهرباء تشارك في لقاءين تواصليين بعمالتي,20 غشت 2022,11:57
الرشيدية : المستشفى الجهوي مولاي علي الشريف يحتضن قافلة طبية,20 غشت 2022,11:37
والي جهة بني ملال يترأس أشغال اللجنة الإقليمية للمبادرة الوطنية,20 غشت 2022,11:05
طقس السبت .. أجواء حارة ومشمسة بمعظم ربوع المملكة,20 غشت 2022,10:09
هبات ملكية الى الشرفاء الصافيين وأشخاص من ذوي الاحتياجات الخاصة,19 غشت 2022,23:44
أمن الناظور يوقف 6 أشخاصٍ يشتبه في تورطهم بشبكة إجرامية,19 غشت 2022,17:46
الحسيمة : اندلاع حريق مهول بغابة جبل أغندرو,19 غشت 2022,16:32
افتتاح متحف الذاكرة اليهودية بالمدينة العتيقة بطنجة,19 غشت 2022,15:24
المكتب الوطني للمطارات : مطارات المغرب تستقبل أزيد من 9,19 غشت 2022,14:40
الناظور : المكتب الوطني للكهرباء والماء الصالح للشرب يرسل لجنة,19 غشت 2022,13:57
رهانات قطاع السياحة وسبل تعزيز واستدامة الدينامية السياحية محور اجتماع,19 غشت 2022,10:42
انطلاق العمل بالثكنة الجديدة للدرك الملكي بشفشاون,19 غشت 2022,10:23
تطوان تحتضن لقاءً تواصلياً حول الإشكاليات المرتبطة بندرة المياه,19 غشت 2022,10:13
المغرب .. توقعات أحوال الطقس اليوم الجمعة,19 غشت 2022,09:56
حرائق كدية الطيفور .. التحقيق يستمر في قضية إضرام النار,18 غشت 2022,20:02
ملف مليلية .. محكمة الاستئناف بالناظور تصدر أحكامها في حق,18 غشت 2022,18:26
ميدلت والريش .. انقطاع مؤقت لحركة السير بعد غد السبت,18 غشت 2022,18:02
مهرجان إمعشار الثقافي 2022 : تزنيت تحتضن النسخة 12 ابتداءً,18 غشت 2022,13:45
طنجة : إنشاء بنيات تحتية نوعية لإزالة التلوث بالساحل الأطلسي,18 غشت 2022,12:45
إقليم ورزازات ينظم لقاءً موسعاً من أجل التشاور حول إعداد,18 غشت 2022,12:19
موسم الصيف 2022 : الصويرة تحطم الرقم القياسي من حيث,18 غشت 2022,11:08
توقعات أحوال الطقس اليوم الخميس بالمغرب,18 غشت 2022,09:49
تحويط شبه كلي لحريق غابة كدية الطيفور,17 غشت 2022,19:16
حادثة خريبكة .. ارتفاع حصيلة الموتى إلى 22 قتيلاً,17 غشت 2022,14:03
الداخلة : مصرع مواطنة أجنبية من جنسية فرنسية جراء عضات,17 غشت 2022,12:03
مصرع 17 شخصاً في حادث سير بين خريبكة والفقيه بن,17 غشت 2022,11:56
نشرة إنذارية : موجة حر تجتاح عدداً من مناطق المغرب,17 غشت 2022,11:17
اللجنة الجهوية للاستثمار بجهة بني ملال تصادق على قرابة 140,17 غشت 2022,10:31
المغرب .. توقعات أحوال الطقس اليوم الأربعاء,17 غشت 2022,09:51
مجهودات فرق الإطفاء لاتزال متواصلة لاحتواء حريق غابة كدية الطيفور,16 غشت 2022,22:15
الوكيل العام للملك : فتح بحث قضائي معمق حول ظروف,16 غشت 2022,21:01
جمارك طنجة تحبط محاولة تهريب أجهزة إلكترونية,16 غشت 2022,20:20
ميدلت تحتضن معرضاً للصناعة التقليدية لتثمين الموروث المغربي,16 غشت 2022,15:58
مصرع 3 أشخاص اختناقاً داخل بئر لاستخراج الفحم الحجري بإقليم,16 غشت 2022,15:09
الأمن الوطني بفاس يوقف 26 مشتبهاً متورطين في حيازة وترويج,16 غشت 2022,14:40
أمن المضيق يوقف أربعة أشخاص مشتبه في تورطهم في إضرام,16 غشت 2022,13:05
اشتوكة أيت باها تحتضن فعاليات المعرض الإقليمي للصناعة التقليدية,16 غشت 2022,12:15
المؤتمر الوطني للطرق 2022 : وزارة التجهيز تعلن بدء عملية,16 غشت 2022,12:04
المندوبية السامية لقدماء المقاومين تنظم مهرجاناً خطابياً بمناسبة تخليد ذكرى,16 غشت 2022,11:16
توقعات أحوال الطقس اليوم الثلاثاء بالمغرب,16 غشت 2022,10:08
المضيق : مصرع 3 إطفائيين وإصابة آخرين إثر انقلاب شاحنة,16 غشت 2022,09:44
تواصل الجهود لإخماد حريق غابوي بغابة كدية الطيفور بالمضيق,15 غشت 2022,22:14
تظاهرة فسيفساء شمالية 2022 : طنجة تحتضن النسخة الثانية يوم,15 غشت 2022,20:15
مهرجان مغاربة العالم بإملشيل 2022 : الدورة الرابعة تشهد مشاركة,15 غشت 2022,17:09
إقليم تزنيت يخلد الذكرى الـ43 لاسترجاع إقليم وادي الذهب,15 غشت 2022,17:03
أمن مكناس يوقف متورطين في السرقة من داخل المنازل وحيازة,15 غشت 2022,16:39
الحكم بثلاث سنوات ونصف سجناً نافذاً على معتد الحسيمة,15 غشت 2022,15:40
اللجنة الإقليمية للتنمية البشرية تصادق على مقترحات مشاريع بميدلت,15 غشت 2022,14:34
ﺟﻤﻌﻴﺔ ﺭﺑﺎﻁ ﺍﻟﻔﺘﺢ ﻟﻠﺘﻨﻤﻴﺔ ﺍﻟﻤﺴﺘﺪﺍﻣﺔ تنظم مسابقة ﺻﻮﺭفوﺗﻮﻏﺮﺍﻓﻴﺔ للاحتفاء بمدينة,15 غشت 2022,12:40
توقعات أحوال الطقس اليوم الإثنين بالمغرب,15 غشت 2022,09:45
انطلاق منافسات الدورة السابعة لتظاهرة 2022 Dakhla Downwind Challenge,15 غشت 2022,09:44
كأس العرش للدراجات الجبلية 2022 : تتويج عبد الله حيدة,15 غشت 2022,00:03
يوم دراسي وشعري بمناسبة الذكرى 43 لاسترجاع إقليم وادي الذهب,14 غشت 2022,19:02
رأس الماء بإفران يستقطب مئات الأطفال والشباب في مرحلته الثالثة,14 غشت 2022,16:24
اختتام النسخة الثانية من برنامج الأكاديمية الأمريكية للريادة 2022 بطنجة,14 غشت 2022,11:29
توقعات أحوال الطقس اليوم الأحد,14 غشت 2022,10:15
تسليم مجموعة من حافلات النقل المدرسي بإقليم تزنيت,13 غشت 2022,16:09
المركز الجهوي للاستثمار بجهة بني ملال ينظم سلسلة من الندوات,13 غشت 2022,14:50
موسم مولاي عبد الله أمغار 2022 : الجديدة تحتضن فعاليات,13 غشت 2022,11:08
المغرب .. توقعات أحوال الطقس اليوم السبت,13 غشت 2022,10:32
تنظيم الأبواب المفتوحة لفائدة المغاربة المقيمين بالخارج بالعيون,13 غشت 2022,09:01
سدود جهة طنجة تطوان تسجّل عجزاً قدره 306.32 مليون متر,12 غشت 2022,16:10
إقليم شيشاوة يحتضن قافلة طبية لجراحة العيون,12 غشت 2022,16:08
ميدلت و الريش .. انقطاع مؤقت لحركة السير غداً السبت,12 غشت 2022,15:22
الجمارك تتلف كميات كبيرة من المخدرات بالقنيطرة,12 غشت 2022,14:08
نشرة إنذارية : طقس حارٌ بعدد من مناطق المملكة,12 غشت 2022,14:01
تزنيت تحتضن فعاليات معرض المنتوجات التقليدية المحلية,12 غشت 2022,12:26
توقعات أحوال الطقس اليوم الجمعة بالمملكة المغربية,12 غشت 2022,09:44
عمالة إقليم تاونات تنظم حفل استقبالٍ على شرف أفراد الجالية,11 غشت 2022,17:05
المركز الجهوي للاستثمار بالداخلة ينظم لقاءً تواصلياً لفائدة أفراد الجالية,11 غشت 2022,12:36
مهرجان الفيلم التربوي لأطفال المخيمات الصيفية 2022: انطلاق فعاليات الدورة,11 غشت 2022,10:50
اليوم الوطني للمهاجر 2022 : ورزازات تحتضن لقاءً تواصلياً حول,11 غشت 2022,10:39
أمن تطوان يوقف عنصراً موالياً لتنظيم داعش الإرهابي,11 غشت 2022,10:02
توقعات أحوال الطقس اليوم الخميس بالمغرب,11 غشت 2022,09:34
مهرجان تاسكوين 2022 : تارودانت تحتضن فعاليات الدورة الثانية,10 غشت 2022,20:44
طنجة : تعبئة 63 مليون درهماً لتمويل مشروع تأهيل سوق,10 غشت 2022,16:04
اليوم الوطني للمهاجر 2022 : عمالة مقاطعات ابن امسيك بالدار,10 غشت 2022,15:33
قافلة القرب بالعالم القروي تحط الرحال بالجديدة سيدي بنور,10 غشت 2022,14:35
مسابقة الصيد بالقصبة 2022 : شاطئ أسكميت بالداخلة يحتضن فعاليات,10 غشت 2022,13:49
كأس العرش للدراجات الجبلية 2022 : أكادير تحتضن فعاليات المنافسة,10 غشت 2022,12:45
نشرة إنذارية : موجة حر تجتاح عددا من مناطق المغرب,10 غشت 2022,12:09
برنامج أوراش 2022 : المجلس الإقليمي لتازة يصادق على اتفاقيات,10 غشت 2022,11:22
المغرب .. توقعات أحوال الطقس اليوم الأربعاء,10 غشت 2022,09:46
مهرجان التبوريدة في زاوية سيدي ابراهيم بمشاركة 22 سربة,10 غشت 2022,09:11
ارتفاع طفيف للأثمان عند الاستهلاك بتطوان,9 غشت 2022,19:21
البحرية الملكية تعلن تقديم المساعدة لــ 23 صياداً بساحل سيدي,9 غشت 2022,17:59
موسم مولاي عبد الله أمغار 2022 : سعد الدين سميج,9 غشت 2022,17:51
مهرجان جدار فن الشارع 2022 : إسدال الستار على النسخة,9 غشت 2022,15:54
المعرض الجهوي للاستثمار والتنمية المستدامة 2022 : الناظور تحتضن فعاليات,9 غشت 2022,15:11
إطلاق مجموعة مشاريع لتمكين المرأة القروية وإدماجها بإقليم طاطا,9 غشت 2022,14:26
المعرض الإقليمي لاشتوكة أيت باها 2022 : مناسبة لتسويق وتثمين,9 غشت 2022,14:21
اختتام قافلة التعمير الجهوية بجماعة سيدي بوتميم بإقليم الحسيمة,9 غشت 2022,13:31
بناء 40 وحدة للتعليم الأولي بإقليم العرائش,9 غشت 2022,13:04
ميدلت والريش .. انقطاع مؤقت لحركة السير يوم غد الأربعاء,9 غشت 2022,09:44
توقعات أحوال الطقس اليوم الثلاثاء بالمملكة المغربية,9 غشت 2022,09:37
جامعة عبد المالك السعدي بتطوان تحتضن لقاءً وطنياً حول الاقتصاد,8 غشت 2022,19:47
طنجة : الرقم الاستدلالي للأثمان عند الاستهلاك يرتفع خلال يونيو,8 غشت 2022,17:48
المجلس الجماعي لأكادير يطلق تطبيقاً رقمياً لتدبير طلبات وحجوزات استغلال,8 غشت 2022,15:41
عاشوراء 2022 : الأمن الوطني يوقف 17 شخصاً,8 غشت 2022,15:32
المندوبية العامة لإدارة السجون توضّح بخصوص امتناع سجين من الاستفادة,8 غشت 2022,15:15
رفع علامة اللواء الأزرق بشاطئ سيدي موسى أكلو بإقليم تزنيت,8 غشت 2022,14:58
قافلة البرلمان المتنقل 2022 : اختتام فعاليات الدورة السادسة بطنجة,8 غشت 2022,14:15
مرحبا 2022 : ميناء طنجة يستقبل أزيد من 530 ألف,8 غشت 2022,11:55
غرفة الصناعة التقليدية بمراكش تنظم معرضاً جهوياً للصناعة التقليدية,8 غشت 2022,10:31
المغرب .. توقعات أحوال الطقس اليوم الإثنين,8 غشت 2022,09:48
الرباط : تنظيم احتفالية بابا عاشور تثمينا للموروث الثقافي الشعبي,7 غشت 2022,23:49
توقعات أحوال الطقس اليوم الأحد,7 غشت 2022,10:33
الجيش الإسباني يبدأ تحطيم معالم جزيرة النكور المحتلة بساحل إقليم,7 غشت 2022,09:33
رسميا .. افتتاح المرآب تحت أرضي باب شالة بالرباط,6 غشت 2022,13:54
قافلة القرب بالعالم القروي تحط الرحال بإقليم تطوان,6 غشت 2022,13:04
قافلة القرب للتعمير تصل إلى إقليم اليوسفية,6 غشت 2022,11:42
الجامعة الخاصة لفاس : تحصل على تجديد الاعتراف من قبل,5 غشت 2022,23:34
RAB AFRICA 2022 : وزارة الثقافة تنظم الدورة الأولى من,5 غشت 2022,17:24
Africa Endeavor .. تنظيم الدورة السادسة لندوة الاتصالات بمراكش,5 غشت 2022,17:11
مؤسسة الحسن التاني للمغاربة المقيمين بالخارج تفتتح مركز استقبال لفائدة,5 غشت 2022,15:47
افتتاح المرآب تحت الأرضي باب شالة يوم غد السبت,5 غشت 2022,15:33
مجلس جهة طنجة يخصص 36 مليون درهم للنهوض بوحدات الاقتصاد,5 غشت 2022,13:18
بناء 30 وحدة للتعليم الأولي بإقليم وزان,5 غشت 2022,13:00
فرق التدخل تنجح في إخماد الحرائق الغابوية بإقليم خنيفرة,5 غشت 2022,10:35
جماعة أيت ملول تحصل على منحة مالية تحفيزية من المديرية,5 غشت 2022,10:11
السجن المحلي بواد لاو يحتفي بنزلائه من التلاميذ والطلبة المتفوقين,5 غشت 2022,09:37
موسم الصيف 2022 : شاطئ عين الذئاب بالدار البيضاء ينخرط,4 غشت 2022,20:45
إطلاق البرنامج الوطني فرصة بجهة بني ملال- خنيفرة,4 غشت 2022,20:28
الوكالة الحضرية لتازة تتخذ مجموعة من التدابير لفائدة المغاربة المقيمين,4 غشت 2022,17:03
تطوان : مطار سانية الرمل يستقبل ما يفوق 66 ألف,4 غشت 2022,15:01
سيدي سليمان : انطلاق المرحلة الثالثة للمبادرة الوطنية للتنمية البشرية,4 غشت 2022,14:15
جماعة الدار البيضاء تدعو الساكنة إلى ترشيد وعدم تبذير المياه,4 غشت 2022,13:15
أكادير : قتلى وجرحى في حادثة سير بمنطقة أمسكرود,4 غشت 2022,12:25
مطار زاكورة يستقبل 4181 مسافراً خلال النصف الأول من السنة,4 غشت 2022,12:04
العربي المحرشي : يترأس اجتماعا تحضيريا ليوم دراسي حول الفرص,4 غشت 2022,09:15
الوليدية .. وجهة سياحية تستقطب الزوار من كل ربوع المغرب,3 غشت 2022,20:55
فرق مكافحة النيران تتمكن من تحويط حرائق على مستوى غابتي,3 غشت 2022,20:04
القافلة الجهوية للتعمير تصل إلى إقليم أزيلال,3 غشت 2022,18:47
الدرك الملكي بالعرائش يحبط محاولة للتهريب الدولي للمخدرات,3 غشت 2022,17:29
انطلاق قافلة القرب للتعمير بجهة سوس ماسة,3 غشت 2022,16:10
انطلاق قافلة القرب بجهة فاس مكناس,3 غشت 2022,14:39
المكتب الوطني للمطارات : مطار ورزازات يستقبل ما يفوق 28,3 غشت 2022,13:16
الرشيدية : مطار مولاي علي الشريف يستقبل أزيد من 20,3 غشت 2022,12:42
مطار وجدة أنكاد يستقبل أزيد من 299 ألف مسافرٍ خلال,3 غشت 2022,11:58
إلغاء مهرجان البيرة Oktoberfest بالمغرب,3 غشت 2022,09:10
مطار الداخلة استقبل أزيد من 101 ألف مسافر خلال النصف,2 غشت 2022,23:15
توزيع إعانات مالية على أصحاب المنازل المتضررة من حريق غابة,2 غشت 2022,22:22
اللجنة الجهوية الموحدة للاستثمار لجهة مراكش – آسفي توافق على,2 غشت 2022,20:05
السيد محمد صديقي يتفقّد إنجاز عدة مشاريع للتنمية الفلاحية بإقليم,2 غشت 2022,19:27
المهرجان الوطني للفيلم بطنجة 2022 : المركز السينمائي المغربي يكشف,2 غشت 2022,18:06
قطاع الصناعة التقليدية محور اتفاقية شراكة بين مؤسسة محمد الخامس,2 غشت 2022,16:49
فتح باب الترشيح لتقديم طلبات تمويل المشاريع في مجال قطاعات,2 غشت 2022,16:12
الجمعية المغربية لتربية الشبيبة تنظم مخيماً صيفياً للأطفال,2 غشت 2022,16:06
وزارة الفلاحة والصيد البحري تؤكد أن قطاع تربية الأحياء البحرية,2 غشت 2022,14:55
إطلاق قافلة التعمير بالجهة الشرقية,2 غشت 2022,14:46
منح علامة مدينة الأراضي الرطبة لمدينة افران,2 غشت 2022,14:35
السيد محمد صديقي يترأس مجلس إدارة الوكالة الوطنية لتنمية تربية,2 غشت 2022,14:20
الوكالة الحضرية لبرشيد تنظّم شباكاً تواصلياً بمطار محمد الخامس بالدار,2 غشت 2022,12:27
مطار ابن بطوطة الدولي يستقبل أزيد من 521 ألف مسافراً,2 غشت 2022,11:29
المجلس الإقليمي للرشيدية يصادق على اتفاقية شراكة لتحسين الجاذبية السياحية,2 غشت 2022,11:27
عميد كلية العلوم القانونية بعين السبع يؤكد أن خطاب عيد,2 غشت 2022,10:27
انطلاق قافلة القرب حول التعمير بإقليم طرفاية,2 غشت 2022,09:45
معبر باب سبتة : توقيف مواطن إسباني للاشتباه في تورطه,1 غشت 2022,17:45
انطلاق قافلة القرب بجهة طنجة تطوان الحسيمة,1 غشت 2022,11:41
أمن الدار البيضاء يوقف شخصين متورطين في التهريب الدولي للمخدرات,1 غشت 2022,10:00
المهرجان الدولي أطفال السلام 2022 : اختتام الدورة 14 بالرباط,31 يوليوز 2022,18:40
الوكالات الحضرية بجهة طنجة-تطوان-الحسيمة تحدث فضاءات تواصلية لخدمة مغاربة العالم,31 يوليوز 2022,10:00
توزيع إعانات مالية على أصحاب المنازل المتضررة من حرائق الغابات,30 يوليوز 2022,18:26
مطار مراكش المنارة يستقبل أزيد من مليون مسافراً خلال النصف,30 يوليوز 2022,16:02
توقيع اتفاقية توأمة بين جماعة الدشيرة ومدينة إيبولي الإيطالية,30 يوليوز 2022,15:08
تنفيذا للتعليمات الملكية : توزيع إعانات مالية على أصحاب المنازل,29 يوليوز 2022,21:14
المحكمة الدستورية تعلن فوز عبد الرحيم بوعيدة ورجوعه لمجلس النواب,29 يوليوز 2022,16:50
طارئ عرضي يسبّب توقيف ضخ الماء بمدينتي فاس ومكناس,29 يوليوز 2022,16:07
إقليم سطات : خفض صبيب الماء الشروب بشبكات التوزيع ابتداءً,29 يوليوز 2022,15:20
المكتب الوطني للكهرباء والماء الصالح للشرب ببرشيد يعلن خفض صبيب,29 يوليوز 2022,15:14
السيطرة على حريق جماعة بني ليت بإقليم تطوان,29 يوليوز 2022,12:04
السيدة فاطمة الزهراء المنصوري تعطي الانطلاقة الرسمية للقافلة التحسيسية للقرب,29 يوليوز 2022,12:00
وزارة إعداد التراب الوطني والتعمير تنظم قافلة للتعمير بالعالم القروي,29 يوليوز 2022,11:02
المهرجان الدولي للمسرح الجامعي 2022 : اختتام فعاليات الدورة 34,29 يوليوز 2022,10:43
افتتاح معرض بطنجة تحت عنوان : نقود المغرب القديم، صور,29 يوليوز 2022,09:02
راشيد الطالبي العلمي : تصريحاتي حرفتها أطراف سياسية لتضليل المغاربة,28 يوليوز 2022,21:23
الرشيدية تحتضن ندوة مجالية حول توجهات السياسة العامة لإعداد التراب,28 يوليوز 2022,20:14
إعادة تأهيل أزيد من 198 كيلومتراً من الطرق بإقليم خنيفرة,28 يوليوز 2022,18:55
وزير التعاون الإسرائيلي يزور مدينة الصويرة,28 يوليوز 2022,16:38
السيد شكيب بنموسى يبرز دور برنامج تكوين مربيات ومربي التعليم,28 يوليوز 2022,16:11
إتلاف أزيد من 3362 كيلوغراماً من مخدر الشيرا بمطرح مديونة,28 يوليوز 2022,15:29
وزارة التعليم العالي والبحث العلمي تطلق برنامج الحق من خلال,28 يوليوز 2022,15:08
نشرة إنذارية : موجة حر تجتاح عدداً من مناطق المغرب,28 يوليوز 2022,13:31
وزارة الشباب والثقافة تعلن تأجيل المهرجان الوطني لفن العيطة بآسفي,28 يوليوز 2022,12:29
السيطرة على حريق دوار واد الرمل بإقليم الفحص أنجرة,28 يوليوز 2022,11:19
العرائش : جهود متواصلة للسيطرة على حريق غابة بوهاشم جبل,28 يوليوز 2022,10:18
افتتاح المركب الرياضي الجامعي بمكناس,28 يوليوز 2022,09:44
الأمن السيبراني في قطاع الصحة محور لقاء دراسي بطنجة,27 يوليوز 2022,21:50
ميدلت والريش .. انقطاع مؤقت لحركة السير يوم السبت المقبل,27 يوليوز 2022,16:58
